,dateRep,day,month,year,cases,deaths,countriesAndTerritories,geoId,countryterritoryCode,popData2018,Date,cummulative_cases,cummulative_deaths,prev_date_cases,prev_date_deaths,new_cases_less_than_prev,new_deaths_less_than_prev,total_cases,total_deaths,times_reduced_last_7_days
93,31/12/2019,31,12,2019,0,0,Afghanistan,AF,AFG,37172386,2019-12-31,0,0,0.0,0.0,1,1,555,18,4
92,01/01/2020,1,1,2020,0,0,Afghanistan,AF,AFG,37172386,2020-01-01,0,0,0.0,0.0,1,1,555,18,4
91,02/01/2020,2,1,2020,0,0,Afghanistan,AF,AFG,37172386,2020-01-02,0,0,0.0,0.0,1,1,555,18,4
90,03/01/2020,3,1,2020,0,0,Afghanistan,AF,AFG,37172386,2020-01-03,0,0,0.0,0.0,1,1,555,18,4
89,04/01/2020,4,1,2020,0,0,Afghanistan,AF,AFG,37172386,2020-01-04,0,0,0.0,0.0,1,1,555,18,4
88,05/01/2020,5,1,2020,0,0,Afghanistan,AF,AFG,37172386,2020-01-05,0,0,0.0,0.0,1,1,555,18,4
87,06/01/2020,6,1,2020,0,0,Afghanistan,AF,AFG,37172386,2020-01-06,0,0,0.0,0.0,1,1,555,18,4
86,07/01/2020,7,1,2020,0,0,Afghanistan,AF,AFG,37172386,2020-01-07,0,0,0.0,0.0,1,1,555,18,4
85,08/01/2020,8,1,2020,0,0,Afghanistan,AF,AFG,37172386,2020-01-08,0,0,0.0,0.0,1,1,555,18,4
84,09/01/2020,9,1,2020,0,0,Afghanistan,AF,AFG,37172386,2020-01-09,0,0,0.0,0.0,1,1,555,18,4
83,10/01/2020,10,1,2020,0,0,Afghanistan,AF,AFG,37172386,2020-01-10,0,0,0.0,0.0,1,1,555,18,4
82,11/01/2020,11,1,2020,0,0,Afghanistan,AF,AFG,37172386,2020-01-11,0,0,0.0,0.0,1,1,555,18,4
81,12/01/2020,12,1,2020,0,0,Afghanistan,AF,AFG,37172386,2020-01-12,0,0,0.0,0.0,1,1,555,18,4
80,13/01/2020,13,1,2020,0,0,Afghanistan,AF,AFG,37172386,2020-01-13,0,0,0.0,0.0,1,1,555,18,4
79,14/01/2020,14,1,2020,0,0,Afghanistan,AF,AFG,37172386,2020-01-14,0,0,0.0,0.0,1,1,555,18,4
78,15/01/2020,15,1,2020,0,0,Afghanistan,AF,AFG,37172386,2020-01-15,0,0,0.0,0.0,1,1,555,18,4
77,16/01/2020,16,1,2020,0,0,Afghanistan,AF,AFG,37172386,2020-01-16,0,0,0.0,0.0,1,1,555,18,4
76,17/01/2020,17,1,2020,0,0,Afghanistan,AF,AFG,37172386,2020-01-17,0,0,0.0,0.0,1,1,555,18,4
75,18/01/2020,18,1,2020,0,0,Afghanistan,AF,AFG,37172386,2020-01-18,0,0,0.0,0.0,1,1,555,18,4
74,19/01/2020,19,1,2020,0,0,Afghanistan,AF,AFG,37172386,2020-01-19,0,0,0.0,0.0,1,1,555,18,4
73,20/01/2020,20,1,2020,0,0,Afghanistan,AF,AFG,37172386,2020-01-20,0,0,0.0,0.0,1,1,555,18,4
72,21/01/2020,21,1,2020,0,0,Afghanistan,AF,AFG,37172386,2020-01-21,0,0,0.0,0.0,1,1,555,18,4
71,22/01/2020,22,1,2020,0,0,Afghanistan,AF,AFG,37172386,2020-01-22,0,0,0.0,0.0,1,1,555,18,4
70,23/01/2020,23,1,2020,0,0,Afghanistan,AF,AFG,37172386,2020-01-23,0,0,0.0,0.0,1,1,555,18,4
69,24/01/2020,24,1,2020,0,0,Afghanistan,AF,AFG,37172386,2020-01-24,0,0,0.0,0.0,1,1,555,18,4
68,25/01/2020,25,1,2020,0,0,Afghanistan,AF,AFG,37172386,2020-01-25,0,0,0.0,0.0,1,1,555,18,4
67,26/01/2020,26,1,2020,0,0,Afghanistan,AF,AFG,37172386,2020-01-26,0,0,0.0,0.0,1,1,555,18,4
66,27/01/2020,27,1,2020,0,0,Afghanistan,AF,AFG,37172386,2020-01-27,0,0,0.0,0.0,1,1,555,18,4
65,28/01/2020,28,1,2020,0,0,Afghanistan,AF,AFG,37172386,2020-01-28,0,0,0.0,0.0,1,1,555,18,4
64,29/01/2020,29,1,2020,0,0,Afghanistan,AF,AFG,37172386,2020-01-29,0,0,0.0,0.0,1,1,555,18,4
63,30/01/2020,30,1,2020,0,0,Afghanistan,AF,AFG,37172386,2020-01-30,0,0,0.0,0.0,1,1,555,18,4
62,31/01/2020,31,1,2020,0,0,Afghanistan,AF,AFG,37172386,2020-01-31,0,0,0.0,0.0,1,1,555,18,4
61,01/02/2020,1,2,2020,0,0,Afghanistan,AF,AFG,37172386,2020-02-01,0,0,0.0,0.0,1,1,555,18,4
60,02/02/2020,2,2,2020,0,0,Afghanistan,AF,AFG,37172386,2020-02-02,0,0,0.0,0.0,1,1,555,18,4
59,03/02/2020,3,2,2020,0,0,Afghanistan,AF,AFG,37172386,2020-02-03,0,0,0.0,0.0,1,1,555,18,4
58,04/02/2020,4,2,2020,0,0,Afghanistan,AF,AFG,37172386,2020-02-04,0,0,0.0,0.0,1,1,555,18,4
57,05/02/2020,5,2,2020,0,0,Afghanistan,AF,AFG,37172386,2020-02-05,0,0,0.0,0.0,1,1,555,18,4
56,06/02/2020,6,2,2020,0,0,Afghanistan,AF,AFG,37172386,2020-02-06,0,0,0.0,0.0,1,1,555,18,4
55,07/02/2020,7,2,2020,0,0,Afghanistan,AF,AFG,37172386,2020-02-07,0,0,0.0,0.0,1,1,555,18,4
54,08/02/2020,8,2,2020,0,0,Afghanistan,AF,AFG,37172386,2020-02-08,0,0,0.0,0.0,1,1,555,18,4
53,09/02/2020,9,2,2020,0,0,Afghanistan,AF,AFG,37172386,2020-02-09,0,0,0.0,0.0,1,1,555,18,4
52,10/02/2020,10,2,2020,0,0,Afghanistan,AF,AFG,37172386,2020-02-10,0,0,0.0,0.0,1,1,555,18,4
51,11/02/2020,11,2,2020,0,0,Afghanistan,AF,AFG,37172386,2020-02-11,0,0,0.0,0.0,1,1,555,18,4
50,12/02/2020,12,2,2020,0,0,Afghanistan,AF,AFG,37172386,2020-02-12,0,0,0.0,0.0,1,1,555,18,4
49,13/02/2020,13,2,2020,0,0,Afghanistan,AF,AFG,37172386,2020-02-13,0,0,0.0,0.0,1,1,555,18,4
48,14/02/2020,14,2,2020,0,0,Afghanistan,AF,AFG,37172386,2020-02-14,0,0,0.0,0.0,1,1,555,18,4
47,15/02/2020,15,2,2020,0,0,Afghanistan,AF,AFG,37172386,2020-02-15,0,0,0.0,0.0,1,1,555,18,4
46,16/02/2020,16,2,2020,0,0,Afghanistan,AF,AFG,37172386,2020-02-16,0,0,0.0,0.0,1,1,555,18,4
45,17/02/2020,17,2,2020,0,0,Afghanistan,AF,AFG,37172386,2020-02-17,0,0,0.0,0.0,1,1,555,18,4
44,18/02/2020,18,2,2020,0,0,Afghanistan,AF,AFG,37172386,2020-02-18,0,0,0.0,0.0,1,1,555,18,4
43,19/02/2020,19,2,2020,0,0,Afghanistan,AF,AFG,37172386,2020-02-19,0,0,0.0,0.0,1,1,555,18,4
42,20/02/2020,20,2,2020,0,0,Afghanistan,AF,AFG,37172386,2020-02-20,0,0,0.0,0.0,1,1,555,18,4
41,21/02/2020,21,2,2020,0,0,Afghanistan,AF,AFG,37172386,2020-02-21,0,0,0.0,0.0,1,1,555,18,4
40,22/02/2020,22,2,2020,0,0,Afghanistan,AF,AFG,37172386,2020-02-22,0,0,0.0,0.0,1,1,555,18,4
39,23/02/2020,23,2,2020,0,0,Afghanistan,AF,AFG,37172386,2020-02-23,0,0,0.0,0.0,1,1,555,18,4
38,24/02/2020,24,2,2020,0,0,Afghanistan,AF,AFG,37172386,2020-02-24,0,0,0.0,0.0,1,1,555,18,4
37,25/02/2020,25,2,2020,1,0,Afghanistan,AF,AFG,37172386,2020-02-25,1,0,0.0,0.0,0,1,555,18,4
36,26/02/2020,26,2,2020,0,0,Afghanistan,AF,AFG,37172386,2020-02-26,1,0,1.0,0.0,1,1,555,18,4
35,27/02/2020,27,2,2020,0,0,Afghanistan,AF,AFG,37172386,2020-02-27,1,0,0.0,0.0,1,1,555,18,4
34,28/02/2020,28,2,2020,0,0,Afghanistan,AF,AFG,37172386,2020-02-28,1,0,0.0,0.0,1,1,555,18,4
33,29/02/2020,29,2,2020,0,0,Afghanistan,AF,AFG,37172386,2020-02-29,1,0,0.0,0.0,1,1,555,18,4
32,01/03/2020,1,3,2020,0,0,Afghanistan,AF,AFG,37172386,2020-03-01,1,0,0.0,0.0,1,1,555,18,4
31,02/03/2020,2,3,2020,0,0,Afghanistan,AF,AFG,37172386,2020-03-02,1,0,0.0,0.0,1,1,555,18,4
30,08/03/2020,8,3,2020,3,0,Afghanistan,AF,AFG,37172386,2020-03-08,4,0,0.0,0.0,0,1,555,18,4
29,11/03/2020,11,3,2020,3,0,Afghanistan,AF,AFG,37172386,2020-03-11,7,0,3.0,0.0,1,1,555,18,4
28,15/03/2020,15,3,2020,3,0,Afghanistan,AF,AFG,37172386,2020-03-15,10,0,3.0,0.0,1,1,555,18,4
27,16/03/2020,16,3,2020,6,0,Afghanistan,AF,AFG,37172386,2020-03-16,16,0,3.0,0.0,0,1,555,18,4
26,17/03/2020,17,3,2020,5,0,Afghanistan,AF,AFG,37172386,2020-03-17,21,0,6.0,0.0,1,1,555,18,4
25,18/03/2020,18,3,2020,1,0,Afghanistan,AF,AFG,37172386,2020-03-18,22,0,5.0,0.0,1,1,555,18,4
24,19/03/2020,19,3,2020,0,0,Afghanistan,AF,AFG,37172386,2020-03-19,22,0,1.0,0.0,1,1,555,18,4
23,20/03/2020,20,3,2020,0,0,Afghanistan,AF,AFG,37172386,2020-03-20,22,0,0.0,0.0,1,1,555,18,4
22,21/03/2020,21,3,2020,2,0,Afghanistan,AF,AFG,37172386,2020-03-21,24,0,0.0,0.0,0,1,555,18,4
21,22/03/2020,22,3,2020,0,0,Afghanistan,AF,AFG,37172386,2020-03-22,24,0,2.0,0.0,1,1,555,18,4
20,23/03/2020,23,3,2020,10,0,Afghanistan,AF,AFG,37172386,2020-03-23,34,0,0.0,0.0,0,1,555,18,4
19,24/03/2020,24,3,2020,6,1,Afghanistan,AF,AFG,37172386,2020-03-24,40,1,10.0,0.0,1,0,555,18,4
18,25/03/2020,25,3,2020,2,0,Afghanistan,AF,AFG,37172386,2020-03-25,42,1,6.0,1.0,1,1,555,18,4
17,26/03/2020,26,3,2020,33,0,Afghanistan,AF,AFG,37172386,2020-03-26,75,1,2.0,0.0,0,1,555,18,4
16,27/03/2020,27,3,2020,0,0,Afghanistan,AF,AFG,37172386,2020-03-27,75,1,33.0,0.0,1,1,555,18,4
15,28/03/2020,28,3,2020,16,1,Afghanistan,AF,AFG,37172386,2020-03-28,91,2,0.0,0.0,0,0,555,18,4
14,29/03/2020,29,3,2020,15,1,Afghanistan,AF,AFG,37172386,2020-03-29,106,3,16.0,1.0,1,1,555,18,4
13,30/03/2020,30,3,2020,8,1,Afghanistan,AF,AFG,37172386,2020-03-30,114,4,15.0,1.0,1,1,555,18,4
12,31/03/2020,31,3,2020,27,0,Afghanistan,AF,AFG,37172386,2020-03-31,141,4,8.0,1.0,0,1,555,18,4
11,01/04/2020,1,4,2020,25,0,Afghanistan,AF,AFG,37172386,2020-04-01,166,4,27.0,0.0,1,1,555,18,4
10,02/04/2020,2,4,2020,26,0,Afghanistan,AF,AFG,37172386,2020-04-02,192,4,25.0,0.0,0,1,555,18,4
9,03/04/2020,3,4,2020,43,0,Afghanistan,AF,AFG,37172386,2020-04-03,235,4,26.0,0.0,0,1,555,18,4
8,04/04/2020,4,4,2020,0,0,Afghanistan,AF,AFG,37172386,2020-04-04,235,4,43.0,0.0,1,1,555,18,4
7,05/04/2020,5,4,2020,35,1,Afghanistan,AF,AFG,37172386,2020-04-05,270,5,0.0,0.0,0,0,555,18,4
6,06/04/2020,6,4,2020,29,2,Afghanistan,AF,AFG,37172386,2020-04-06,299,7,35.0,1.0,1,0,555,18,4
5,07/04/2020,7,4,2020,38,0,Afghanistan,AF,AFG,37172386,2020-04-07,337,7,29.0,2.0,0,1,555,18,4
4,08/04/2020,8,4,2020,30,4,Afghanistan,AF,AFG,37172386,2020-04-08,367,11,38.0,0.0,1,0,555,18,4
3,09/04/2020,9,4,2020,56,3,Afghanistan,AF,AFG,37172386,2020-04-09,423,14,30.0,4.0,0,1,555,18,4
2,10/04/2020,10,4,2020,61,1,Afghanistan,AF,AFG,37172386,2020-04-10,484,15,56.0,3.0,0,1,555,18,4
1,11/04/2020,11,4,2020,37,0,Afghanistan,AF,AFG,37172386,2020-04-11,521,15,61.0,1.0,1,1,555,18,4
0,12/04/2020,12,4,2020,34,3,Afghanistan,AF,AFG,37172386,2020-04-12,555,18,37.0,0.0,1,0,555,18,4
128,09/03/2020,9,3,2020,2,0,Albania,AL,ALB,2866376,2020-03-09,2,0,0.0,0.0,0,1,433,23,5
127,10/03/2020,10,3,2020,4,0,Albania,AL,ALB,2866376,2020-03-10,6,0,2.0,0.0,0,1,433,23,5
126,11/03/2020,11,3,2020,4,0,Albania,AL,ALB,2866376,2020-03-11,10,0,4.0,0.0,1,1,433,23,5
125,12/03/2020,12,3,2020,1,1,Albania,AL,ALB,2866376,2020-03-12,11,1,4.0,0.0,1,0,433,23,5
124,13/03/2020,13,3,2020,12,0,Albania,AL,ALB,2866376,2020-03-13,23,1,1.0,1.0,0,1,433,23,5
123,14/03/2020,14,3,2020,10,0,Albania,AL,ALB,2866376,2020-03-14,33,1,12.0,0.0,1,1,433,23,5
122,15/03/2020,15,3,2020,5,0,Albania,AL,ALB,2866376,2020-03-15,38,1,10.0,0.0,1,1,433,23,5
121,16/03/2020,16,3,2020,4,0,Albania,AL,ALB,2866376,2020-03-16,42,1,5.0,0.0,1,1,433,23,5
120,17/03/2020,17,3,2020,9,0,Albania,AL,ALB,2866376,2020-03-17,51,1,4.0,0.0,0,1,433,23,5
119,18/03/2020,18,3,2020,4,0,Albania,AL,ALB,2866376,2020-03-18,55,1,9.0,0.0,1,1,433,23,5
118,19/03/2020,19,3,2020,4,1,Albania,AL,ALB,2866376,2020-03-19,59,2,4.0,0.0,1,0,433,23,5
117,20/03/2020,20,3,2020,11,0,Albania,AL,ALB,2866376,2020-03-20,70,2,4.0,1.0,0,1,433,23,5
116,21/03/2020,21,3,2020,0,0,Albania,AL,ALB,2866376,2020-03-21,70,2,11.0,0.0,1,1,433,23,5
115,22/03/2020,22,3,2020,6,0,Albania,AL,ALB,2866376,2020-03-22,76,2,0.0,0.0,0,1,433,23,5
114,23/03/2020,23,3,2020,13,0,Albania,AL,ALB,2866376,2020-03-23,89,2,6.0,0.0,0,1,433,23,5
113,24/03/2020,24,3,2020,11,2,Albania,AL,ALB,2866376,2020-03-24,100,4,13.0,0.0,1,0,433,23,5
112,25/03/2020,25,3,2020,23,1,Albania,AL,ALB,2866376,2020-03-25,123,5,11.0,2.0,0,1,433,23,5
111,26/03/2020,26,3,2020,23,0,Albania,AL,ALB,2866376,2020-03-26,146,5,23.0,1.0,1,1,433,23,5
110,27/03/2020,27,3,2020,28,1,Albania,AL,ALB,2866376,2020-03-27,174,6,23.0,0.0,0,0,433,23,5
109,28/03/2020,28,3,2020,12,3,Albania,AL,ALB,2866376,2020-03-28,186,9,28.0,1.0,1,0,433,23,5
108,29/03/2020,29,3,2020,11,1,Albania,AL,ALB,2866376,2020-03-29,197,10,12.0,3.0,1,1,433,23,5
107,30/03/2020,30,3,2020,15,0,Albania,AL,ALB,2866376,2020-03-30,212,10,11.0,1.0,0,1,433,23,5
106,31/03/2020,31,3,2020,11,2,Albania,AL,ALB,2866376,2020-03-31,223,12,15.0,0.0,1,0,433,23,5
105,01/04/2020,1,4,2020,20,3,Albania,AL,ALB,2866376,2020-04-01,243,15,11.0,2.0,0,0,433,23,5
104,02/04/2020,2,4,2020,16,0,Albania,AL,ALB,2866376,2020-04-02,259,15,20.0,3.0,1,1,433,23,5
103,03/04/2020,3,4,2020,18,1,Albania,AL,ALB,2866376,2020-04-03,277,16,16.0,0.0,0,0,433,23,5
102,04/04/2020,4,4,2020,27,1,Albania,AL,ALB,2866376,2020-04-04,304,17,18.0,1.0,0,1,433,23,5
101,05/04/2020,5,4,2020,29,2,Albania,AL,ALB,2866376,2020-04-05,333,19,27.0,1.0,0,0,433,23,5
100,06/04/2020,6,4,2020,28,2,Albania,AL,ALB,2866376,2020-04-06,361,21,29.0,2.0,1,1,433,23,5
99,07/04/2020,7,4,2020,16,1,Albania,AL,ALB,2866376,2020-04-07,377,22,28.0,2.0,1,1,433,23,5
98,08/04/2020,8,4,2020,6,0,Albania,AL,ALB,2866376,2020-04-08,383,22,16.0,1.0,1,1,433,23,5
97,09/04/2020,9,4,2020,17,0,Albania,AL,ALB,2866376,2020-04-09,400,22,6.0,0.0,0,1,433,23,5
96,10/04/2020,10,4,2020,9,1,Albania,AL,ALB,2866376,2020-04-10,409,23,17.0,0.0,1,0,433,23,5
95,11/04/2020,11,4,2020,7,0,Albania,AL,ALB,2866376,2020-04-11,416,23,9.0,1.0,1,1,433,23,5
94,12/04/2020,12,4,2020,17,0,Albania,AL,ALB,2866376,2020-04-12,433,23,7.0,0.0,0,1,433,23,5
227,31/12/2019,31,12,2019,0,0,Algeria,DZ,DZA,42228429,2019-12-31,0,0,0.0,0.0,1,1,1825,275,4
226,01/01/2020,1,1,2020,0,0,Algeria,DZ,DZA,42228429,2020-01-01,0,0,0.0,0.0,1,1,1825,275,4
225,02/01/2020,2,1,2020,0,0,Algeria,DZ,DZA,42228429,2020-01-02,0,0,0.0,0.0,1,1,1825,275,4
224,03/01/2020,3,1,2020,0,0,Algeria,DZ,DZA,42228429,2020-01-03,0,0,0.0,0.0,1,1,1825,275,4
223,04/01/2020,4,1,2020,0,0,Algeria,DZ,DZA,42228429,2020-01-04,0,0,0.0,0.0,1,1,1825,275,4
222,05/01/2020,5,1,2020,0,0,Algeria,DZ,DZA,42228429,2020-01-05,0,0,0.0,0.0,1,1,1825,275,4
221,06/01/2020,6,1,2020,0,0,Algeria,DZ,DZA,42228429,2020-01-06,0,0,0.0,0.0,1,1,1825,275,4
220,07/01/2020,7,1,2020,0,0,Algeria,DZ,DZA,42228429,2020-01-07,0,0,0.0,0.0,1,1,1825,275,4
219,08/01/2020,8,1,2020,0,0,Algeria,DZ,DZA,42228429,2020-01-08,0,0,0.0,0.0,1,1,1825,275,4
218,09/01/2020,9,1,2020,0,0,Algeria,DZ,DZA,42228429,2020-01-09,0,0,0.0,0.0,1,1,1825,275,4
217,10/01/2020,10,1,2020,0,0,Algeria,DZ,DZA,42228429,2020-01-10,0,0,0.0,0.0,1,1,1825,275,4
216,11/01/2020,11,1,2020,0,0,Algeria,DZ,DZA,42228429,2020-01-11,0,0,0.0,0.0,1,1,1825,275,4
215,12/01/2020,12,1,2020,0,0,Algeria,DZ,DZA,42228429,2020-01-12,0,0,0.0,0.0,1,1,1825,275,4
214,13/01/2020,13,1,2020,0,0,Algeria,DZ,DZA,42228429,2020-01-13,0,0,0.0,0.0,1,1,1825,275,4
213,14/01/2020,14,1,2020,0,0,Algeria,DZ,DZA,42228429,2020-01-14,0,0,0.0,0.0,1,1,1825,275,4
212,15/01/2020,15,1,2020,0,0,Algeria,DZ,DZA,42228429,2020-01-15,0,0,0.0,0.0,1,1,1825,275,4
211,16/01/2020,16,1,2020,0,0,Algeria,DZ,DZA,42228429,2020-01-16,0,0,0.0,0.0,1,1,1825,275,4
210,17/01/2020,17,1,2020,0,0,Algeria,DZ,DZA,42228429,2020-01-17,0,0,0.0,0.0,1,1,1825,275,4
209,18/01/2020,18,1,2020,0,0,Algeria,DZ,DZA,42228429,2020-01-18,0,0,0.0,0.0,1,1,1825,275,4
208,19/01/2020,19,1,2020,0,0,Algeria,DZ,DZA,42228429,2020-01-19,0,0,0.0,0.0,1,1,1825,275,4
207,20/01/2020,20,1,2020,0,0,Algeria,DZ,DZA,42228429,2020-01-20,0,0,0.0,0.0,1,1,1825,275,4
206,21/01/2020,21,1,2020,0,0,Algeria,DZ,DZA,42228429,2020-01-21,0,0,0.0,0.0,1,1,1825,275,4
205,22/01/2020,22,1,2020,0,0,Algeria,DZ,DZA,42228429,2020-01-22,0,0,0.0,0.0,1,1,1825,275,4
204,23/01/2020,23,1,2020,0,0,Algeria,DZ,DZA,42228429,2020-01-23,0,0,0.0,0.0,1,1,1825,275,4
203,24/01/2020,24,1,2020,0,0,Algeria,DZ,DZA,42228429,2020-01-24,0,0,0.0,0.0,1,1,1825,275,4
202,25/01/2020,25,1,2020,0,0,Algeria,DZ,DZA,42228429,2020-01-25,0,0,0.0,0.0,1,1,1825,275,4
201,26/01/2020,26,1,2020,0,0,Algeria,DZ,DZA,42228429,2020-01-26,0,0,0.0,0.0,1,1,1825,275,4
200,27/01/2020,27,1,2020,0,0,Algeria,DZ,DZA,42228429,2020-01-27,0,0,0.0,0.0,1,1,1825,275,4
199,28/01/2020,28,1,2020,0,0,Algeria,DZ,DZA,42228429,2020-01-28,0,0,0.0,0.0,1,1,1825,275,4
198,29/01/2020,29,1,2020,0,0,Algeria,DZ,DZA,42228429,2020-01-29,0,0,0.0,0.0,1,1,1825,275,4
197,30/01/2020,30,1,2020,0,0,Algeria,DZ,DZA,42228429,2020-01-30,0,0,0.0,0.0,1,1,1825,275,4
196,31/01/2020,31,1,2020,0,0,Algeria,DZ,DZA,42228429,2020-01-31,0,0,0.0,0.0,1,1,1825,275,4
195,01/02/2020,1,2,2020,0,0,Algeria,DZ,DZA,42228429,2020-02-01,0,0,0.0,0.0,1,1,1825,275,4
194,02/02/2020,2,2,2020,0,0,Algeria,DZ,DZA,42228429,2020-02-02,0,0,0.0,0.0,1,1,1825,275,4
193,03/02/2020,3,2,2020,0,0,Algeria,DZ,DZA,42228429,2020-02-03,0,0,0.0,0.0,1,1,1825,275,4
192,04/02/2020,4,2,2020,0,0,Algeria,DZ,DZA,42228429,2020-02-04,0,0,0.0,0.0,1,1,1825,275,4
191,05/02/2020,5,2,2020,0,0,Algeria,DZ,DZA,42228429,2020-02-05,0,0,0.0,0.0,1,1,1825,275,4
190,06/02/2020,6,2,2020,0,0,Algeria,DZ,DZA,42228429,2020-02-06,0,0,0.0,0.0,1,1,1825,275,4
189,07/02/2020,7,2,2020,0,0,Algeria,DZ,DZA,42228429,2020-02-07,0,0,0.0,0.0,1,1,1825,275,4
188,08/02/2020,8,2,2020,0,0,Algeria,DZ,DZA,42228429,2020-02-08,0,0,0.0,0.0,1,1,1825,275,4
187,09/02/2020,9,2,2020,0,0,Algeria,DZ,DZA,42228429,2020-02-09,0,0,0.0,0.0,1,1,1825,275,4
186,10/02/2020,10,2,2020,0,0,Algeria,DZ,DZA,42228429,2020-02-10,0,0,0.0,0.0,1,1,1825,275,4
185,11/02/2020,11,2,2020,0,0,Algeria,DZ,DZA,42228429,2020-02-11,0,0,0.0,0.0,1,1,1825,275,4
184,12/02/2020,12,2,2020,0,0,Algeria,DZ,DZA,42228429,2020-02-12,0,0,0.0,0.0,1,1,1825,275,4
183,13/02/2020,13,2,2020,0,0,Algeria,DZ,DZA,42228429,2020-02-13,0,0,0.0,0.0,1,1,1825,275,4
182,14/02/2020,14,2,2020,0,0,Algeria,DZ,DZA,42228429,2020-02-14,0,0,0.0,0.0,1,1,1825,275,4
181,15/02/2020,15,2,2020,0,0,Algeria,DZ,DZA,42228429,2020-02-15,0,0,0.0,0.0,1,1,1825,275,4
180,16/02/2020,16,2,2020,0,0,Algeria,DZ,DZA,42228429,2020-02-16,0,0,0.0,0.0,1,1,1825,275,4
179,17/02/2020,17,2,2020,0,0,Algeria,DZ,DZA,42228429,2020-02-17,0,0,0.0,0.0,1,1,1825,275,4
178,18/02/2020,18,2,2020,0,0,Algeria,DZ,DZA,42228429,2020-02-18,0,0,0.0,0.0,1,1,1825,275,4
177,19/02/2020,19,2,2020,0,0,Algeria,DZ,DZA,42228429,2020-02-19,0,0,0.0,0.0,1,1,1825,275,4
176,20/02/2020,20,2,2020,0,0,Algeria,DZ,DZA,42228429,2020-02-20,0,0,0.0,0.0,1,1,1825,275,4
175,21/02/2020,21,2,2020,0,0,Algeria,DZ,DZA,42228429,2020-02-21,0,0,0.0,0.0,1,1,1825,275,4
174,22/02/2020,22,2,2020,0,0,Algeria,DZ,DZA,42228429,2020-02-22,0,0,0.0,0.0,1,1,1825,275,4
173,23/02/2020,23,2,2020,0,0,Algeria,DZ,DZA,42228429,2020-02-23,0,0,0.0,0.0,1,1,1825,275,4
172,24/02/2020,24,2,2020,0,0,Algeria,DZ,DZA,42228429,2020-02-24,0,0,0.0,0.0,1,1,1825,275,4
171,25/02/2020,25,2,2020,0,0,Algeria,DZ,DZA,42228429,2020-02-25,0,0,0.0,0.0,1,1,1825,275,4
170,26/02/2020,26,2,2020,1,0,Algeria,DZ,DZA,42228429,2020-02-26,1,0,0.0,0.0,0,1,1825,275,4
169,27/02/2020,27,2,2020,0,0,Algeria,DZ,DZA,42228429,2020-02-27,1,0,1.0,0.0,1,1,1825,275,4
168,28/02/2020,28,2,2020,0,0,Algeria,DZ,DZA,42228429,2020-02-28,1,0,0.0,0.0,1,1,1825,275,4
167,29/02/2020,29,2,2020,0,0,Algeria,DZ,DZA,42228429,2020-02-29,1,0,0.0,0.0,1,1,1825,275,4
166,01/03/2020,1,3,2020,0,0,Algeria,DZ,DZA,42228429,2020-03-01,1,0,0.0,0.0,1,1,1825,275,4
165,02/03/2020,2,3,2020,2,0,Algeria,DZ,DZA,42228429,2020-03-02,3,0,0.0,0.0,0,1,1825,275,4
164,04/03/2020,4,3,2020,2,0,Algeria,DZ,DZA,42228429,2020-03-04,5,0,2.0,0.0,1,1,1825,275,4
163,05/03/2020,5,3,2020,7,0,Algeria,DZ,DZA,42228429,2020-03-05,12,0,2.0,0.0,0,1,1825,275,4
162,06/03/2020,6,3,2020,5,0,Algeria,DZ,DZA,42228429,2020-03-06,17,0,7.0,0.0,1,1,1825,275,4
161,09/03/2020,9,3,2020,3,0,Algeria,DZ,DZA,42228429,2020-03-09,20,0,5.0,0.0,1,1,1825,275,4
160,12/03/2020,12,3,2020,0,0,Algeria,DZ,DZA,42228429,2020-03-12,20,0,3.0,0.0,1,1,1825,275,4
159,13/03/2020,13,3,2020,4,1,Algeria,DZ,DZA,42228429,2020-03-13,24,1,0.0,0.0,0,0,1825,275,4
158,14/03/2020,14,3,2020,2,1,Algeria,DZ,DZA,42228429,2020-03-14,26,2,4.0,1.0,1,1,1825,275,4
157,15/03/2020,15,3,2020,11,0,Algeria,DZ,DZA,42228429,2020-03-15,37,2,2.0,1.0,0,1,1825,275,4
156,16/03/2020,16,3,2020,11,2,Algeria,DZ,DZA,42228429,2020-03-16,48,4,11.0,0.0,1,0,1825,275,4
155,17/03/2020,17,3,2020,12,0,Algeria,DZ,DZA,42228429,2020-03-17,60,4,11.0,2.0,0,1,1825,275,4
154,18/03/2020,18,3,2020,0,1,Algeria,DZ,DZA,42228429,2020-03-18,60,5,12.0,0.0,1,0,1825,275,4
153,19/03/2020,19,3,2020,13,1,Algeria,DZ,DZA,42228429,2020-03-19,73,6,0.0,1.0,0,1,1825,275,4
152,20/03/2020,20,3,2020,9,1,Algeria,DZ,DZA,42228429,2020-03-20,82,7,13.0,1.0,1,1,1825,275,4
151,21/03/2020,21,3,2020,12,3,Algeria,DZ,DZA,42228429,2020-03-21,94,10,9.0,1.0,0,0,1825,275,4
150,22/03/2020,22,3,2020,0,0,Algeria,DZ,DZA,42228429,2020-03-22,94,10,12.0,3.0,1,1,1825,275,4
149,23/03/2020,23,3,2020,8,5,Algeria,DZ,DZA,42228429,2020-03-23,102,15,0.0,0.0,0,0,1825,275,4
148,24/03/2020,24,3,2020,87,2,Algeria,DZ,DZA,42228429,2020-03-24,189,17,8.0,5.0,0,1,1825,275,4
147,25/03/2020,25,3,2020,42,0,Algeria,DZ,DZA,42228429,2020-03-25,231,17,87.0,2.0,1,1,1825,275,4
146,26/03/2020,26,3,2020,33,0,Algeria,DZ,DZA,42228429,2020-03-26,264,17,42.0,0.0,1,1,1825,275,4
145,27/03/2020,27,3,2020,41,4,Algeria,DZ,DZA,42228429,2020-03-27,305,21,33.0,0.0,0,0,1825,275,4
144,28/03/2020,28,3,2020,0,0,Algeria,DZ,DZA,42228429,2020-03-28,305,21,41.0,4.0,1,1,1825,275,4
143,29/03/2020,29,3,2020,104,5,Algeria,DZ,DZA,42228429,2020-03-29,409,26,0.0,0.0,0,0,1825,275,4
142,30/03/2020,30,3,2020,45,3,Algeria,DZ,DZA,42228429,2020-03-30,454,29,104.0,5.0,1,1,1825,275,4
141,31/03/2020,31,3,2020,57,2,Algeria,DZ,DZA,42228429,2020-03-31,511,31,45.0,3.0,0,1,1825,275,4
140,01/04/2020,1,4,2020,73,4,Algeria,DZ,DZA,42228429,2020-04-01,584,35,57.0,2.0,0,0,1825,275,4
139,02/04/2020,2,4,2020,263,23,Algeria,DZ,DZA,42228429,2020-04-02,847,58,73.0,4.0,0,0,1825,275,4
138,03/04/2020,3,4,2020,0,0,Algeria,DZ,DZA,42228429,2020-04-03,847,58,263.0,23.0,1,1,1825,275,4
137,04/04/2020,4,4,2020,139,25,Algeria,DZ,DZA,42228429,2020-04-04,986,83,0.0,0.0,0,0,1825,275,4
136,05/04/2020,5,4,2020,314,47,Algeria,DZ,DZA,42228429,2020-04-05,1300,130,139.0,25.0,0,0,1825,275,4
135,06/04/2020,6,4,2020,20,22,Algeria,DZ,DZA,42228429,2020-04-06,1320,152,314.0,47.0,1,1,1825,275,4
134,07/04/2020,7,4,2020,103,21,Algeria,DZ,DZA,42228429,2020-04-07,1423,173,20.0,22.0,0,1,1825,275,4
133,08/04/2020,8,4,2020,45,21,Algeria,DZ,DZA,42228429,2020-04-08,1468,194,103.0,21.0,1,1,1825,275,4
132,09/04/2020,9,4,2020,104,11,Algeria,DZ,DZA,42228429,2020-04-09,1572,205,45.0,21.0,0,1,1825,275,4
131,10/04/2020,10,4,2020,94,30,Algeria,DZ,DZA,42228429,2020-04-10,1666,235,104.0,11.0,1,0,1825,275,4
130,11/04/2020,11,4,2020,95,21,Algeria,DZ,DZA,42228429,2020-04-11,1761,256,94.0,30.0,0,1,1825,275,4
129,12/04/2020,12,4,2020,64,19,Algeria,DZ,DZA,42228429,2020-04-12,1825,275,95.0,21.0,1,1,1825,275,4
257,03/03/2020,3,3,2020,1,0,Andorra,AD,AND,77006,2020-03-03,1,0,0.0,0.0,0,1,622,28,5
256,14/03/2020,14,3,2020,1,0,Andorra,AD,AND,77006,2020-03-14,2,0,1.0,0.0,1,1,622,28,5
255,16/03/2020,16,3,2020,3,0,Andorra,AD,AND,77006,2020-03-16,5,0,1.0,0.0,0,1,622,28,5
254,17/03/2020,17,3,2020,9,0,Andorra,AD,AND,77006,2020-03-17,14,0,3.0,0.0,0,1,622,28,5
253,18/03/2020,18,3,2020,0,0,Andorra,AD,AND,77006,2020-03-18,14,0,9.0,0.0,1,1,622,28,5
252,19/03/2020,19,3,2020,39,0,Andorra,AD,AND,77006,2020-03-19,53,0,0.0,0.0,0,1,622,28,5
251,20/03/2020,20,3,2020,22,0,Andorra,AD,AND,77006,2020-03-20,75,0,39.0,0.0,1,1,622,28,5
250,21/03/2020,21,3,2020,0,0,Andorra,AD,AND,77006,2020-03-21,75,0,22.0,0.0,1,1,622,28,5
249,22/03/2020,22,3,2020,13,0,Andorra,AD,AND,77006,2020-03-22,88,0,0.0,0.0,0,1,622,28,5
248,23/03/2020,23,3,2020,25,0,Andorra,AD,AND,77006,2020-03-23,113,0,13.0,0.0,0,1,622,28,5
247,24/03/2020,24,3,2020,20,0,Andorra,AD,AND,77006,2020-03-24,133,0,25.0,0.0,1,1,622,28,5
246,25/03/2020,25,3,2020,31,0,Andorra,AD,AND,77006,2020-03-25,164,0,20.0,0.0,0,1,622,28,5
245,26/03/2020,26,3,2020,24,0,Andorra,AD,AND,77006,2020-03-26,188,0,31.0,0.0,1,1,622,28,5
244,27/03/2020,27,3,2020,36,3,Andorra,AD,AND,77006,2020-03-27,224,3,24.0,0.0,0,0,622,28,5
243,28/03/2020,28,3,2020,43,0,Andorra,AD,AND,77006,2020-03-28,267,3,36.0,3.0,0,1,622,28,5
242,29/03/2020,29,3,2020,41,1,Andorra,AD,AND,77006,2020-03-29,308,4,43.0,0.0,1,0,622,28,5
241,30/03/2020,30,3,2020,26,2,Andorra,AD,AND,77006,2020-03-30,334,6,41.0,1.0,1,0,622,28,5
240,31/03/2020,31,3,2020,36,2,Andorra,AD,AND,77006,2020-03-31,370,8,26.0,2.0,0,1,622,28,5
239,01/04/2020,1,4,2020,6,4,Andorra,AD,AND,77006,2020-04-01,376,12,36.0,2.0,1,0,622,28,5
238,02/04/2020,2,4,2020,14,2,Andorra,AD,AND,77006,2020-04-02,390,14,6.0,4.0,0,1,622,28,5
237,03/04/2020,3,4,2020,38,1,Andorra,AD,AND,77006,2020-04-03,428,15,14.0,2.0,0,1,622,28,5
236,04/04/2020,4,4,2020,11,1,Andorra,AD,AND,77006,2020-04-04,439,16,38.0,1.0,1,1,622,28,5
235,05/04/2020,5,4,2020,27,1,Andorra,AD,AND,77006,2020-04-05,466,17,11.0,1.0,0,1,622,28,5
234,06/04/2020,6,4,2020,35,1,Andorra,AD,AND,77006,2020-04-06,501,18,27.0,1.0,0,1,622,28,5
233,07/04/2020,7,4,2020,25,3,Andorra,AD,AND,77006,2020-04-07,526,21,35.0,1.0,1,0,622,28,5
232,08/04/2020,8,4,2020,19,1,Andorra,AD,AND,77006,2020-04-08,545,22,25.0,3.0,1,1,622,28,5
231,09/04/2020,9,4,2020,19,1,Andorra,AD,AND,77006,2020-04-09,564,23,19.0,1.0,1,1,622,28,5
230,10/04/2020,10,4,2020,19,2,Andorra,AD,AND,77006,2020-04-10,583,25,19.0,1.0,1,0,622,28,5
229,11/04/2020,11,4,2020,18,1,Andorra,AD,AND,77006,2020-04-11,601,26,19.0,2.0,1,1,622,28,5
228,12/04/2020,12,4,2020,21,2,Andorra,AD,AND,77006,2020-04-12,622,28,18.0,1.0,0,0,622,28,5
279,22/03/2020,22,3,2020,2,0,Angola,AO,AGO,30809762,2020-03-22,2,0,0.0,0.0,0,1,19,2,5
278,23/03/2020,23,3,2020,0,0,Angola,AO,AGO,30809762,2020-03-23,2,0,2.0,0.0,1,1,19,2,5
277,24/03/2020,24,3,2020,0,0,Angola,AO,AGO,30809762,2020-03-24,2,0,0.0,0.0,1,1,19,2,5
276,25/03/2020,25,3,2020,0,0,Angola,AO,AGO,30809762,2020-03-25,2,0,0.0,0.0,1,1,19,2,5
275,26/03/2020,26,3,2020,0,0,Angola,AO,AGO,30809762,2020-03-26,2,0,0.0,0.0,1,1,19,2,5
274,27/03/2020,27,3,2020,1,0,Angola,AO,AGO,30809762,2020-03-27,3,0,0.0,0.0,0,1,19,2,5
273,28/03/2020,28,3,2020,1,0,Angola,AO,AGO,30809762,2020-03-28,4,0,1.0,0.0,1,1,19,2,5
272,29/03/2020,29,3,2020,0,0,Angola,AO,AGO,30809762,2020-03-29,4,0,1.0,0.0,1,1,19,2,5
271,30/03/2020,30,3,2020,3,2,Angola,AO,AGO,30809762,2020-03-30,7,2,0.0,0.0,0,0,19,2,5
270,31/03/2020,31,3,2020,0,0,Angola,AO,AGO,30809762,2020-03-31,7,2,3.0,2.0,1,1,19,2,5
269,01/04/2020,1,4,2020,0,0,Angola,AO,AGO,30809762,2020-04-01,7,2,0.0,0.0,1,1,19,2,5
268,02/04/2020,2,4,2020,1,0,Angola,AO,AGO,30809762,2020-04-02,8,2,0.0,0.0,0,1,19,2,5
267,03/04/2020,3,4,2020,0,0,Angola,AO,AGO,30809762,2020-04-03,8,2,1.0,0.0,1,1,19,2,5
266,04/04/2020,4,4,2020,0,0,Angola,AO,AGO,30809762,2020-04-04,8,2,0.0,0.0,1,1,19,2,5
265,05/04/2020,5,4,2020,2,0,Angola,AO,AGO,30809762,2020-04-05,10,2,0.0,0.0,0,1,19,2,5
264,06/04/2020,6,4,2020,4,0,Angola,AO,AGO,30809762,2020-04-06,14,2,2.0,0.0,0,1,19,2,5
263,07/04/2020,7,4,2020,2,0,Angola,AO,AGO,30809762,2020-04-07,16,2,4.0,0.0,1,1,19,2,5
262,08/04/2020,8,4,2020,1,0,Angola,AO,AGO,30809762,2020-04-08,17,2,2.0,0.0,1,1,19,2,5
261,09/04/2020,9,4,2020,2,0,Angola,AO,AGO,30809762,2020-04-09,19,2,1.0,0.0,0,1,19,2,5
260,10/04/2020,10,4,2020,0,0,Angola,AO,AGO,30809762,2020-04-10,19,2,2.0,0.0,1,1,19,2,5
259,11/04/2020,11,4,2020,0,0,Angola,AO,AGO,30809762,2020-04-11,19,2,0.0,0.0,1,1,19,2,5
258,12/04/2020,12,4,2020,0,0,Angola,AO,AGO,30809762,2020-04-12,19,2,0.0,0.0,1,1,19,2,5
296,27/03/2020,27,3,2020,2,0,Anguilla,AI,,,2020-03-27,2,0,0.0,0.0,0,1,3,0,7
295,28/03/2020,28,3,2020,0,0,Anguilla,AI,,,2020-03-28,2,0,2.0,0.0,1,1,3,0,7
294,29/03/2020,29,3,2020,0,0,Anguilla,AI,,,2020-03-29,2,0,0.0,0.0,1,1,3,0,7
293,30/03/2020,30,3,2020,0,0,Anguilla,AI,,,2020-03-30,2,0,0.0,0.0,1,1,3,0,7
292,31/03/2020,31,3,2020,0,0,Anguilla,AI,,,2020-03-31,2,0,0.0,0.0,1,1,3,0,7
291,01/04/2020,1,4,2020,0,0,Anguilla,AI,,,2020-04-01,2,0,0.0,0.0,1,1,3,0,7
290,02/04/2020,2,4,2020,0,0,Anguilla,AI,,,2020-04-02,2,0,0.0,0.0,1,1,3,0,7
289,03/04/2020,3,4,2020,1,0,Anguilla,AI,,,2020-04-03,3,0,0.0,0.0,0,1,3,0,7
288,04/04/2020,4,4,2020,0,0,Anguilla,AI,,,2020-04-04,3,0,1.0,0.0,1,1,3,0,7
287,05/04/2020,5,4,2020,0,0,Anguilla,AI,,,2020-04-05,3,0,0.0,0.0,1,1,3,0,7
286,06/04/2020,6,4,2020,0,0,Anguilla,AI,,,2020-04-06,3,0,0.0,0.0,1,1,3,0,7
285,07/04/2020,7,4,2020,0,0,Anguilla,AI,,,2020-04-07,3,0,0.0,0.0,1,1,3,0,7
284,08/04/2020,8,4,2020,0,0,Anguilla,AI,,,2020-04-08,3,0,0.0,0.0,1,1,3,0,7
283,09/04/2020,9,4,2020,0,0,Anguilla,AI,,,2020-04-09,3,0,0.0,0.0,1,1,3,0,7
282,10/04/2020,10,4,2020,0,0,Anguilla,AI,,,2020-04-10,3,0,0.0,0.0,1,1,3,0,7
281,11/04/2020,11,4,2020,0,0,Anguilla,AI,,,2020-04-11,3,0,0.0,0.0,1,1,3,0,7
280,12/04/2020,12,4,2020,0,0,Anguilla,AI,,,2020-04-12,3,0,0.0,0.0,1,1,3,0,7
320,15/03/2020,15,3,2020,1,0,Antigua_and_Barbuda,AG,ATG,96286,2020-03-15,1,0,0.0,0.0,0,1,21,2,6
319,21/03/2020,21,3,2020,0,0,Antigua_and_Barbuda,AG,ATG,96286,2020-03-21,1,0,1.0,0.0,1,1,21,2,6
318,22/03/2020,22,3,2020,0,0,Antigua_and_Barbuda,AG,ATG,96286,2020-03-22,1,0,0.0,0.0,1,1,21,2,6
317,23/03/2020,23,3,2020,0,0,Antigua_and_Barbuda,AG,ATG,96286,2020-03-23,1,0,0.0,0.0,1,1,21,2,6
316,24/03/2020,24,3,2020,0,0,Antigua_and_Barbuda,AG,ATG,96286,2020-03-24,1,0,0.0,0.0,1,1,21,2,6
315,25/03/2020,25,3,2020,2,0,Antigua_and_Barbuda,AG,ATG,96286,2020-03-25,3,0,0.0,0.0,0,1,21,2,6
314,26/03/2020,26,3,2020,0,0,Antigua_and_Barbuda,AG,ATG,96286,2020-03-26,3,0,2.0,0.0,1,1,21,2,6
313,27/03/2020,27,3,2020,4,0,Antigua_and_Barbuda,AG,ATG,96286,2020-03-27,7,0,0.0,0.0,0,1,21,2,6
312,28/03/2020,28,3,2020,0,0,Antigua_and_Barbuda,AG,ATG,96286,2020-03-28,7,0,4.0,0.0,1,1,21,2,6
311,29/03/2020,29,3,2020,0,0,Antigua_and_Barbuda,AG,ATG,96286,2020-03-29,7,0,0.0,0.0,1,1,21,2,6
310,30/03/2020,30,3,2020,0,0,Antigua_and_Barbuda,AG,ATG,96286,2020-03-30,7,0,0.0,0.0,1,1,21,2,6
309,31/03/2020,31,3,2020,0,0,Antigua_and_Barbuda,AG,ATG,96286,2020-03-31,7,0,0.0,0.0,1,1,21,2,6
308,01/04/2020,1,4,2020,0,0,Antigua_and_Barbuda,AG,ATG,96286,2020-04-01,7,0,0.0,0.0,1,1,21,2,6
307,02/04/2020,2,4,2020,0,0,Antigua_and_Barbuda,AG,ATG,96286,2020-04-02,7,0,0.0,0.0,1,1,21,2,6
306,03/04/2020,3,4,2020,2,0,Antigua_and_Barbuda,AG,ATG,96286,2020-04-03,9,0,0.0,0.0,0,1,21,2,6
305,04/04/2020,4,4,2020,6,0,Antigua_and_Barbuda,AG,ATG,96286,2020-04-04,15,0,2.0,0.0,0,1,21,2,6
304,05/04/2020,5,4,2020,0,0,Antigua_and_Barbuda,AG,ATG,96286,2020-04-05,15,0,6.0,0.0,1,1,21,2,6
303,06/04/2020,6,4,2020,0,0,Antigua_and_Barbuda,AG,ATG,96286,2020-04-06,15,0,0.0,0.0,1,1,21,2,6
302,07/04/2020,7,4,2020,0,0,Antigua_and_Barbuda,AG,ATG,96286,2020-04-07,15,0,0.0,0.0,1,1,21,2,6
301,08/04/2020,8,4,2020,0,0,Antigua_and_Barbuda,AG,ATG,96286,2020-04-08,15,0,0.0,0.0,1,1,21,2,6
300,09/04/2020,9,4,2020,0,0,Antigua_and_Barbuda,AG,ATG,96286,2020-04-09,15,0,0.0,0.0,1,1,21,2,6
299,10/04/2020,10,4,2020,4,2,Antigua_and_Barbuda,AG,ATG,96286,2020-04-10,19,2,0.0,0.0,0,0,21,2,6
298,11/04/2020,11,4,2020,2,0,Antigua_and_Barbuda,AG,ATG,96286,2020-04-11,21,2,4.0,2.0,1,1,21,2,6
297,12/04/2020,12,4,2020,0,0,Antigua_and_Barbuda,AG,ATG,96286,2020-04-12,21,2,2.0,0.0,1,1,21,2,6
357,04/03/2020,4,3,2020,1,0,Argentina,AR,ARG,44494502,2020-03-04,1,0,0.0,0.0,0,1,2137,89,4
356,06/03/2020,6,3,2020,1,0,Argentina,AR,ARG,44494502,2020-03-06,2,0,1.0,0.0,1,1,2137,89,4
355,07/03/2020,7,3,2020,6,0,Argentina,AR,ARG,44494502,2020-03-07,8,0,1.0,0.0,0,1,2137,89,4
354,08/03/2020,8,3,2020,1,1,Argentina,AR,ARG,44494502,2020-03-08,9,1,6.0,0.0,1,0,2137,89,4
353,09/03/2020,9,3,2020,3,0,Argentina,AR,ARG,44494502,2020-03-09,12,1,1.0,1.0,0,1,2137,89,4
352,11/03/2020,11,3,2020,7,0,Argentina,AR,ARG,44494502,2020-03-11,19,1,3.0,0.0,0,1,2137,89,4
351,13/03/2020,13,3,2020,12,0,Argentina,AR,ARG,44494502,2020-03-13,31,1,7.0,0.0,0,1,2137,89,4
350,14/03/2020,14,3,2020,3,1,Argentina,AR,ARG,44494502,2020-03-14,34,2,12.0,0.0,1,0,2137,89,4
349,15/03/2020,15,3,2020,11,0,Argentina,AR,ARG,44494502,2020-03-15,45,2,3.0,1.0,0,1,2137,89,4
348,16/03/2020,16,3,2020,11,0,Argentina,AR,ARG,44494502,2020-03-16,56,2,11.0,0.0,1,1,2137,89,4
347,17/03/2020,17,3,2020,9,0,Argentina,AR,ARG,44494502,2020-03-17,65,2,11.0,0.0,1,1,2137,89,4
346,18/03/2020,18,3,2020,14,0,Argentina,AR,ARG,44494502,2020-03-18,79,2,9.0,0.0,0,1,2137,89,4
345,19/03/2020,19,3,2020,18,0,Argentina,AR,ARG,44494502,2020-03-19,97,2,14.0,0.0,0,1,2137,89,4
344,20/03/2020,20,3,2020,31,1,Argentina,AR,ARG,44494502,2020-03-20,128,3,18.0,0.0,0,0,2137,89,4
343,21/03/2020,21,3,2020,30,0,Argentina,AR,ARG,44494502,2020-03-21,158,3,31.0,1.0,1,1,2137,89,4
342,22/03/2020,22,3,2020,67,1,Argentina,AR,ARG,44494502,2020-03-22,225,4,30.0,0.0,0,0,2137,89,4
341,23/03/2020,23,3,2020,41,0,Argentina,AR,ARG,44494502,2020-03-23,266,4,67.0,1.0,1,1,2137,89,4
340,24/03/2020,24,3,2020,35,0,Argentina,AR,ARG,44494502,2020-03-24,301,4,41.0,0.0,1,1,2137,89,4
339,25/03/2020,25,3,2020,86,2,Argentina,AR,ARG,44494502,2020-03-25,387,6,35.0,0.0,0,0,2137,89,4
338,26/03/2020,26,3,2020,115,2,Argentina,AR,ARG,44494502,2020-03-26,502,8,86.0,2.0,0,1,2137,89,4
337,27/03/2020,27,3,2020,87,4,Argentina,AR,ARG,44494502,2020-03-27,589,12,115.0,2.0,1,0,2137,89,4
336,28/03/2020,28,3,2020,101,5,Argentina,AR,ARG,44494502,2020-03-28,690,17,87.0,4.0,0,0,2137,89,4
335,29/03/2020,29,3,2020,55,2,Argentina,AR,ARG,44494502,2020-03-29,745,19,101.0,5.0,1,1,2137,89,4
334,30/03/2020,30,3,2020,75,1,Argentina,AR,ARG,44494502,2020-03-30,820,20,55.0,2.0,0,1,2137,89,4
333,31/03/2020,31,3,2020,146,4,Argentina,AR,ARG,44494502,2020-03-31,966,24,75.0,1.0,0,0,2137,89,4
332,01/04/2020,1,4,2020,0,0,Argentina,AR,ARG,44494502,2020-04-01,966,24,146.0,4.0,1,1,2137,89,4
331,02/04/2020,2,4,2020,167,7,Argentina,AR,ARG,44494502,2020-04-02,1133,31,0.0,0.0,0,0,2137,89,4
330,03/04/2020,3,4,2020,0,3,Argentina,AR,ARG,44494502,2020-04-03,1133,34,167.0,7.0,1,1,2137,89,4
329,04/04/2020,4,4,2020,132,3,Argentina,AR,ARG,44494502,2020-04-04,1265,37,0.0,3.0,0,1,2137,89,4
328,05/04/2020,5,4,2020,186,6,Argentina,AR,ARG,44494502,2020-04-05,1451,43,132.0,3.0,0,0,2137,89,4
327,06/04/2020,6,4,2020,103,3,Argentina,AR,ARG,44494502,2020-04-06,1554,46,186.0,6.0,1,1,2137,89,4
326,07/04/2020,7,4,2020,74,7,Argentina,AR,ARG,44494502,2020-04-07,1628,53,103.0,3.0,1,0,2137,89,4
325,08/04/2020,8,4,2020,87,7,Argentina,AR,ARG,44494502,2020-04-08,1715,60,74.0,7.0,0,1,2137,89,4
324,09/04/2020,9,4,2020,80,5,Argentina,AR,ARG,44494502,2020-04-09,1795,65,87.0,7.0,1,1,2137,89,4
323,10/04/2020,10,4,2020,99,14,Argentina,AR,ARG,44494502,2020-04-10,1894,79,80.0,5.0,0,0,2137,89,4
322,11/04/2020,11,4,2020,81,3,Argentina,AR,ARG,44494502,2020-04-11,1975,82,99.0,14.0,1,1,2137,89,4
321,12/04/2020,12,4,2020,162,7,Argentina,AR,ARG,44494502,2020-04-12,2137,89,81.0,3.0,0,0,2137,89,4
452,31/12/2019,31,12,2019,0,0,Armenia,AM,ARM,2951776,2019-12-31,0,0,0.0,0.0,1,1,967,13,2
451,01/01/2020,1,1,2020,0,0,Armenia,AM,ARM,2951776,2020-01-01,0,0,0.0,0.0,1,1,967,13,2
450,02/01/2020,2,1,2020,0,0,Armenia,AM,ARM,2951776,2020-01-02,0,0,0.0,0.0,1,1,967,13,2
449,03/01/2020,3,1,2020,0,0,Armenia,AM,ARM,2951776,2020-01-03,0,0,0.0,0.0,1,1,967,13,2
448,04/01/2020,4,1,2020,0,0,Armenia,AM,ARM,2951776,2020-01-04,0,0,0.0,0.0,1,1,967,13,2
447,05/01/2020,5,1,2020,0,0,Armenia,AM,ARM,2951776,2020-01-05,0,0,0.0,0.0,1,1,967,13,2
446,06/01/2020,6,1,2020,0,0,Armenia,AM,ARM,2951776,2020-01-06,0,0,0.0,0.0,1,1,967,13,2
445,07/01/2020,7,1,2020,0,0,Armenia,AM,ARM,2951776,2020-01-07,0,0,0.0,0.0,1,1,967,13,2
444,08/01/2020,8,1,2020,0,0,Armenia,AM,ARM,2951776,2020-01-08,0,0,0.0,0.0,1,1,967,13,2
443,09/01/2020,9,1,2020,0,0,Armenia,AM,ARM,2951776,2020-01-09,0,0,0.0,0.0,1,1,967,13,2
442,10/01/2020,10,1,2020,0,0,Armenia,AM,ARM,2951776,2020-01-10,0,0,0.0,0.0,1,1,967,13,2
441,11/01/2020,11,1,2020,0,0,Armenia,AM,ARM,2951776,2020-01-11,0,0,0.0,0.0,1,1,967,13,2
440,12/01/2020,12,1,2020,0,0,Armenia,AM,ARM,2951776,2020-01-12,0,0,0.0,0.0,1,1,967,13,2
439,13/01/2020,13,1,2020,0,0,Armenia,AM,ARM,2951776,2020-01-13,0,0,0.0,0.0,1,1,967,13,2
438,14/01/2020,14,1,2020,0,0,Armenia,AM,ARM,2951776,2020-01-14,0,0,0.0,0.0,1,1,967,13,2
437,15/01/2020,15,1,2020,0,0,Armenia,AM,ARM,2951776,2020-01-15,0,0,0.0,0.0,1,1,967,13,2
436,16/01/2020,16,1,2020,0,0,Armenia,AM,ARM,2951776,2020-01-16,0,0,0.0,0.0,1,1,967,13,2
435,17/01/2020,17,1,2020,0,0,Armenia,AM,ARM,2951776,2020-01-17,0,0,0.0,0.0,1,1,967,13,2
434,18/01/2020,18,1,2020,0,0,Armenia,AM,ARM,2951776,2020-01-18,0,0,0.0,0.0,1,1,967,13,2
433,19/01/2020,19,1,2020,0,0,Armenia,AM,ARM,2951776,2020-01-19,0,0,0.0,0.0,1,1,967,13,2
432,20/01/2020,20,1,2020,0,0,Armenia,AM,ARM,2951776,2020-01-20,0,0,0.0,0.0,1,1,967,13,2
431,21/01/2020,21,1,2020,0,0,Armenia,AM,ARM,2951776,2020-01-21,0,0,0.0,0.0,1,1,967,13,2
430,22/01/2020,22,1,2020,0,0,Armenia,AM,ARM,2951776,2020-01-22,0,0,0.0,0.0,1,1,967,13,2
429,23/01/2020,23,1,2020,0,0,Armenia,AM,ARM,2951776,2020-01-23,0,0,0.0,0.0,1,1,967,13,2
428,24/01/2020,24,1,2020,0,0,Armenia,AM,ARM,2951776,2020-01-24,0,0,0.0,0.0,1,1,967,13,2
427,25/01/2020,25,1,2020,0,0,Armenia,AM,ARM,2951776,2020-01-25,0,0,0.0,0.0,1,1,967,13,2
426,26/01/2020,26,1,2020,0,0,Armenia,AM,ARM,2951776,2020-01-26,0,0,0.0,0.0,1,1,967,13,2
425,27/01/2020,27,1,2020,0,0,Armenia,AM,ARM,2951776,2020-01-27,0,0,0.0,0.0,1,1,967,13,2
424,28/01/2020,28,1,2020,0,0,Armenia,AM,ARM,2951776,2020-01-28,0,0,0.0,0.0,1,1,967,13,2
423,29/01/2020,29,1,2020,0,0,Armenia,AM,ARM,2951776,2020-01-29,0,0,0.0,0.0,1,1,967,13,2
422,30/01/2020,30,1,2020,0,0,Armenia,AM,ARM,2951776,2020-01-30,0,0,0.0,0.0,1,1,967,13,2
421,31/01/2020,31,1,2020,0,0,Armenia,AM,ARM,2951776,2020-01-31,0,0,0.0,0.0,1,1,967,13,2
420,01/02/2020,1,2,2020,0,0,Armenia,AM,ARM,2951776,2020-02-01,0,0,0.0,0.0,1,1,967,13,2
419,02/02/2020,2,2,2020,0,0,Armenia,AM,ARM,2951776,2020-02-02,0,0,0.0,0.0,1,1,967,13,2
418,03/02/2020,3,2,2020,0,0,Armenia,AM,ARM,2951776,2020-02-03,0,0,0.0,0.0,1,1,967,13,2
417,04/02/2020,4,2,2020,0,0,Armenia,AM,ARM,2951776,2020-02-04,0,0,0.0,0.0,1,1,967,13,2
416,05/02/2020,5,2,2020,0,0,Armenia,AM,ARM,2951776,2020-02-05,0,0,0.0,0.0,1,1,967,13,2
415,06/02/2020,6,2,2020,0,0,Armenia,AM,ARM,2951776,2020-02-06,0,0,0.0,0.0,1,1,967,13,2
414,07/02/2020,7,2,2020,0,0,Armenia,AM,ARM,2951776,2020-02-07,0,0,0.0,0.0,1,1,967,13,2
413,08/02/2020,8,2,2020,0,0,Armenia,AM,ARM,2951776,2020-02-08,0,0,0.0,0.0,1,1,967,13,2
412,09/02/2020,9,2,2020,0,0,Armenia,AM,ARM,2951776,2020-02-09,0,0,0.0,0.0,1,1,967,13,2
411,10/02/2020,10,2,2020,0,0,Armenia,AM,ARM,2951776,2020-02-10,0,0,0.0,0.0,1,1,967,13,2
410,11/02/2020,11,2,2020,0,0,Armenia,AM,ARM,2951776,2020-02-11,0,0,0.0,0.0,1,1,967,13,2
409,12/02/2020,12,2,2020,0,0,Armenia,AM,ARM,2951776,2020-02-12,0,0,0.0,0.0,1,1,967,13,2
408,13/02/2020,13,2,2020,0,0,Armenia,AM,ARM,2951776,2020-02-13,0,0,0.0,0.0,1,1,967,13,2
407,14/02/2020,14,2,2020,0,0,Armenia,AM,ARM,2951776,2020-02-14,0,0,0.0,0.0,1,1,967,13,2
406,15/02/2020,15,2,2020,0,0,Armenia,AM,ARM,2951776,2020-02-15,0,0,0.0,0.0,1,1,967,13,2
405,16/02/2020,16,2,2020,0,0,Armenia,AM,ARM,2951776,2020-02-16,0,0,0.0,0.0,1,1,967,13,2
404,17/02/2020,17,2,2020,0,0,Armenia,AM,ARM,2951776,2020-02-17,0,0,0.0,0.0,1,1,967,13,2
403,18/02/2020,18,2,2020,0,0,Armenia,AM,ARM,2951776,2020-02-18,0,0,0.0,0.0,1,1,967,13,2
402,19/02/2020,19,2,2020,0,0,Armenia,AM,ARM,2951776,2020-02-19,0,0,0.0,0.0,1,1,967,13,2
401,20/02/2020,20,2,2020,0,0,Armenia,AM,ARM,2951776,2020-02-20,0,0,0.0,0.0,1,1,967,13,2
400,21/02/2020,21,2,2020,0,0,Armenia,AM,ARM,2951776,2020-02-21,0,0,0.0,0.0,1,1,967,13,2
399,22/02/2020,22,2,2020,0,0,Armenia,AM,ARM,2951776,2020-02-22,0,0,0.0,0.0,1,1,967,13,2
398,23/02/2020,23,2,2020,0,0,Armenia,AM,ARM,2951776,2020-02-23,0,0,0.0,0.0,1,1,967,13,2
397,24/02/2020,24,2,2020,0,0,Armenia,AM,ARM,2951776,2020-02-24,0,0,0.0,0.0,1,1,967,13,2
396,25/02/2020,25,2,2020,0,0,Armenia,AM,ARM,2951776,2020-02-25,0,0,0.0,0.0,1,1,967,13,2
395,26/02/2020,26,2,2020,0,0,Armenia,AM,ARM,2951776,2020-02-26,0,0,0.0,0.0,1,1,967,13,2
394,27/02/2020,27,2,2020,0,0,Armenia,AM,ARM,2951776,2020-02-27,0,0,0.0,0.0,1,1,967,13,2
393,28/02/2020,28,2,2020,0,0,Armenia,AM,ARM,2951776,2020-02-28,0,0,0.0,0.0,1,1,967,13,2
392,29/02/2020,29,2,2020,0,0,Armenia,AM,ARM,2951776,2020-02-29,0,0,0.0,0.0,1,1,967,13,2
391,01/03/2020,1,3,2020,1,0,Armenia,AM,ARM,2951776,2020-03-01,1,0,0.0,0.0,0,1,967,13,2
390,02/03/2020,2,3,2020,0,0,Armenia,AM,ARM,2951776,2020-03-02,1,0,1.0,0.0,1,1,967,13,2
389,12/03/2020,12,3,2020,3,0,Armenia,AM,ARM,2951776,2020-03-12,4,0,0.0,0.0,0,1,967,13,2
388,13/03/2020,13,3,2020,2,0,Armenia,AM,ARM,2951776,2020-03-13,6,0,3.0,0.0,1,1,967,13,2
387,14/03/2020,14,3,2020,7,0,Armenia,AM,ARM,2951776,2020-03-14,13,0,2.0,0.0,0,1,967,13,2
386,15/03/2020,15,3,2020,7,0,Armenia,AM,ARM,2951776,2020-03-15,20,0,7.0,0.0,1,1,967,13,2
385,16/03/2020,16,3,2020,10,0,Armenia,AM,ARM,2951776,2020-03-16,30,0,7.0,0.0,0,1,967,13,2
384,17/03/2020,17,3,2020,22,0,Armenia,AM,ARM,2951776,2020-03-17,52,0,10.0,0.0,0,1,967,13,2
383,18/03/2020,18,3,2020,26,0,Armenia,AM,ARM,2951776,2020-03-18,78,0,22.0,0.0,0,1,967,13,2
382,19/03/2020,19,3,2020,37,0,Armenia,AM,ARM,2951776,2020-03-19,115,0,26.0,0.0,0,1,967,13,2
381,20/03/2020,20,3,2020,7,0,Armenia,AM,ARM,2951776,2020-03-20,122,0,37.0,0.0,1,1,967,13,2
380,21/03/2020,21,3,2020,14,0,Armenia,AM,ARM,2951776,2020-03-21,136,0,7.0,0.0,0,1,967,13,2
379,22/03/2020,22,3,2020,24,0,Armenia,AM,ARM,2951776,2020-03-22,160,0,14.0,0.0,0,1,967,13,2
378,23/03/2020,23,3,2020,30,0,Armenia,AM,ARM,2951776,2020-03-23,190,0,24.0,0.0,0,1,967,13,2
377,24/03/2020,24,3,2020,4,0,Armenia,AM,ARM,2951776,2020-03-24,194,0,30.0,0.0,1,1,967,13,2
376,25/03/2020,25,3,2020,71,0,Armenia,AM,ARM,2951776,2020-03-25,265,0,4.0,0.0,0,1,967,13,2
375,26/03/2020,26,3,2020,25,0,Armenia,AM,ARM,2951776,2020-03-26,290,0,71.0,0.0,1,1,967,13,2
374,27/03/2020,27,3,2020,39,1,Armenia,AM,ARM,2951776,2020-03-27,329,1,25.0,0.0,0,0,967,13,2
373,28/03/2020,28,3,2020,43,0,Armenia,AM,ARM,2951776,2020-03-28,372,1,39.0,1.0,0,1,967,13,2
372,29/03/2020,29,3,2020,52,2,Armenia,AM,ARM,2951776,2020-03-29,424,3,43.0,0.0,0,0,967,13,2
371,30/03/2020,30,3,2020,0,0,Armenia,AM,ARM,2951776,2020-03-30,424,3,52.0,2.0,1,1,967,13,2
370,31/03/2020,31,3,2020,58,0,Armenia,AM,ARM,2951776,2020-03-31,482,3,0.0,0.0,0,1,967,13,2
369,01/04/2020,1,4,2020,50,0,Armenia,AM,ARM,2951776,2020-04-01,532,3,58.0,0.0,1,1,967,13,2
368,02/04/2020,2,4,2020,39,0,Armenia,AM,ARM,2951776,2020-04-02,571,3,50.0,0.0,1,1,967,13,2
367,03/04/2020,3,4,2020,92,1,Armenia,AM,ARM,2951776,2020-04-03,663,4,39.0,0.0,0,0,967,13,2
366,04/04/2020,4,4,2020,73,3,Armenia,AM,ARM,2951776,2020-04-04,736,7,92.0,1.0,1,0,967,13,2
365,05/04/2020,5,4,2020,34,0,Armenia,AM,ARM,2951776,2020-04-05,770,7,73.0,3.0,1,1,967,13,2
364,06/04/2020,6,4,2020,52,0,Armenia,AM,ARM,2951776,2020-04-06,822,7,34.0,0.0,0,1,967,13,2
363,07/04/2020,7,4,2020,11,1,Armenia,AM,ARM,2951776,2020-04-07,833,8,52.0,0.0,1,0,967,13,2
362,08/04/2020,8,4,2020,20,0,Armenia,AM,ARM,2951776,2020-04-08,853,8,11.0,1.0,0,1,967,13,2
361,09/04/2020,9,4,2020,28,1,Armenia,AM,ARM,2951776,2020-04-09,881,9,20.0,0.0,0,0,967,13,2
360,10/04/2020,10,4,2020,40,1,Armenia,AM,ARM,2951776,2020-04-10,921,10,28.0,1.0,0,1,967,13,2
359,11/04/2020,11,4,2020,16,1,Armenia,AM,ARM,2951776,2020-04-11,937,11,40.0,1.0,1,1,967,13,2
358,12/04/2020,12,4,2020,30,2,Armenia,AM,ARM,2951776,2020-04-12,967,13,16.0,1.0,0,0,967,13,2
473,13/03/2020,13,3,2020,2,0,Aruba,AW,ABW,105845,2020-03-13,2,0,0.0,0.0,0,1,92,0,4
472,20/03/2020,20,3,2020,2,0,Aruba,AW,ABW,105845,2020-03-20,4,0,2.0,0.0,1,1,92,0,4
471,24/03/2020,24,3,2020,8,0,Aruba,AW,ABW,105845,2020-03-24,12,0,2.0,0.0,0,1,92,0,4
470,25/03/2020,25,3,2020,5,0,Aruba,AW,ABW,105845,2020-03-25,17,0,8.0,0.0,1,1,92,0,4
469,26/03/2020,26,3,2020,2,0,Aruba,AW,ABW,105845,2020-03-26,19,0,5.0,0.0,1,1,92,0,4
468,27/03/2020,27,3,2020,9,0,Aruba,AW,ABW,105845,2020-03-27,28,0,2.0,0.0,0,1,92,0,4
467,28/03/2020,28,3,2020,0,0,Aruba,AW,ABW,105845,2020-03-28,28,0,9.0,0.0,1,1,92,0,4
466,29/03/2020,29,3,2020,0,0,Aruba,AW,ABW,105845,2020-03-29,28,0,0.0,0.0,1,1,92,0,4
465,30/03/2020,30,3,2020,22,0,Aruba,AW,ABW,105845,2020-03-30,50,0,0.0,0.0,0,1,92,0,4
464,01/04/2020,1,4,2020,5,0,Aruba,AW,ABW,105845,2020-04-01,55,0,22.0,0.0,1,1,92,0,4
463,02/04/2020,2,4,2020,0,0,Aruba,AW,ABW,105845,2020-04-02,55,0,5.0,0.0,1,1,92,0,4
462,03/04/2020,3,4,2020,5,0,Aruba,AW,ABW,105845,2020-04-03,60,0,0.0,0.0,0,1,92,0,4
461,04/04/2020,4,4,2020,2,0,Aruba,AW,ABW,105845,2020-04-04,62,0,5.0,0.0,1,1,92,0,4
460,05/04/2020,5,4,2020,2,0,Aruba,AW,ABW,105845,2020-04-05,64,0,2.0,0.0,1,1,92,0,4
459,06/04/2020,6,4,2020,0,0,Aruba,AW,ABW,105845,2020-04-06,64,0,2.0,0.0,1,1,92,0,4
458,07/04/2020,7,4,2020,7,0,Aruba,AW,ABW,105845,2020-04-07,71,0,0.0,0.0,0,1,92,0,4
457,08/04/2020,8,4,2020,3,0,Aruba,AW,ABW,105845,2020-04-08,74,0,7.0,0.0,1,1,92,0,4
456,09/04/2020,9,4,2020,3,0,Aruba,AW,ABW,105845,2020-04-09,77,0,3.0,0.0,1,1,92,0,4
455,10/04/2020,10,4,2020,5,0,Aruba,AW,ABW,105845,2020-04-10,82,0,3.0,0.0,0,1,92,0,4
454,11/04/2020,11,4,2020,4,0,Aruba,AW,ABW,105845,2020-04-11,86,0,5.0,0.0,1,1,92,0,4
453,12/04/2020,12,4,2020,6,0,Aruba,AW,ABW,105845,2020-04-12,92,0,4.0,0.0,0,1,92,0,4
577,31/12/2019,31,12,2019,0,0,Australia,AU,AUS,24992369,2019-12-31,0,0,0.0,0.0,1,1,6289,57,4
576,01/01/2020,1,1,2020,0,0,Australia,AU,AUS,24992369,2020-01-01,0,0,0.0,0.0,1,1,6289,57,4
575,02/01/2020,2,1,2020,0,0,Australia,AU,AUS,24992369,2020-01-02,0,0,0.0,0.0,1,1,6289,57,4
574,03/01/2020,3,1,2020,0,0,Australia,AU,AUS,24992369,2020-01-03,0,0,0.0,0.0,1,1,6289,57,4
573,04/01/2020,4,1,2020,0,0,Australia,AU,AUS,24992369,2020-01-04,0,0,0.0,0.0,1,1,6289,57,4
572,05/01/2020,5,1,2020,0,0,Australia,AU,AUS,24992369,2020-01-05,0,0,0.0,0.0,1,1,6289,57,4
571,06/01/2020,6,1,2020,0,0,Australia,AU,AUS,24992369,2020-01-06,0,0,0.0,0.0,1,1,6289,57,4
570,07/01/2020,7,1,2020,0,0,Australia,AU,AUS,24992369,2020-01-07,0,0,0.0,0.0,1,1,6289,57,4
569,08/01/2020,8,1,2020,0,0,Australia,AU,AUS,24992369,2020-01-08,0,0,0.0,0.0,1,1,6289,57,4
568,09/01/2020,9,1,2020,0,0,Australia,AU,AUS,24992369,2020-01-09,0,0,0.0,0.0,1,1,6289,57,4
567,10/01/2020,10,1,2020,0,0,Australia,AU,AUS,24992369,2020-01-10,0,0,0.0,0.0,1,1,6289,57,4
566,11/01/2020,11,1,2020,0,0,Australia,AU,AUS,24992369,2020-01-11,0,0,0.0,0.0,1,1,6289,57,4
565,12/01/2020,12,1,2020,0,0,Australia,AU,AUS,24992369,2020-01-12,0,0,0.0,0.0,1,1,6289,57,4
564,13/01/2020,13,1,2020,0,0,Australia,AU,AUS,24992369,2020-01-13,0,0,0.0,0.0,1,1,6289,57,4
563,14/01/2020,14,1,2020,0,0,Australia,AU,AUS,24992369,2020-01-14,0,0,0.0,0.0,1,1,6289,57,4
562,15/01/2020,15,1,2020,0,0,Australia,AU,AUS,24992369,2020-01-15,0,0,0.0,0.0,1,1,6289,57,4
561,16/01/2020,16,1,2020,0,0,Australia,AU,AUS,24992369,2020-01-16,0,0,0.0,0.0,1,1,6289,57,4
560,17/01/2020,17,1,2020,0,0,Australia,AU,AUS,24992369,2020-01-17,0,0,0.0,0.0,1,1,6289,57,4
559,18/01/2020,18,1,2020,0,0,Australia,AU,AUS,24992369,2020-01-18,0,0,0.0,0.0,1,1,6289,57,4
558,19/01/2020,19,1,2020,0,0,Australia,AU,AUS,24992369,2020-01-19,0,0,0.0,0.0,1,1,6289,57,4
557,20/01/2020,20,1,2020,0,0,Australia,AU,AUS,24992369,2020-01-20,0,0,0.0,0.0,1,1,6289,57,4
556,21/01/2020,21,1,2020,0,0,Australia,AU,AUS,24992369,2020-01-21,0,0,0.0,0.0,1,1,6289,57,4
555,22/01/2020,22,1,2020,0,0,Australia,AU,AUS,24992369,2020-01-22,0,0,0.0,0.0,1,1,6289,57,4
554,23/01/2020,23,1,2020,0,0,Australia,AU,AUS,24992369,2020-01-23,0,0,0.0,0.0,1,1,6289,57,4
553,24/01/2020,24,1,2020,0,0,Australia,AU,AUS,24992369,2020-01-24,0,0,0.0,0.0,1,1,6289,57,4
552,25/01/2020,25,1,2020,1,0,Australia,AU,AUS,24992369,2020-01-25,1,0,0.0,0.0,0,1,6289,57,4
551,26/01/2020,26,1,2020,3,0,Australia,AU,AUS,24992369,2020-01-26,4,0,1.0,0.0,0,1,6289,57,4
550,27/01/2020,27,1,2020,0,0,Australia,AU,AUS,24992369,2020-01-27,4,0,3.0,0.0,1,1,6289,57,4
549,28/01/2020,28,1,2020,0,0,Australia,AU,AUS,24992369,2020-01-28,4,0,0.0,0.0,1,1,6289,57,4
548,29/01/2020,29,1,2020,0,0,Australia,AU,AUS,24992369,2020-01-29,4,0,0.0,0.0,1,1,6289,57,4
547,30/01/2020,30,1,2020,2,0,Australia,AU,AUS,24992369,2020-01-30,6,0,0.0,0.0,0,1,6289,57,4
546,31/01/2020,31,1,2020,1,0,Australia,AU,AUS,24992369,2020-01-31,7,0,2.0,0.0,1,1,6289,57,4
545,01/02/2020,1,2,2020,2,0,Australia,AU,AUS,24992369,2020-02-01,9,0,1.0,0.0,0,1,6289,57,4
544,02/02/2020,2,2,2020,2,0,Australia,AU,AUS,24992369,2020-02-02,11,0,2.0,0.0,1,1,6289,57,4
543,03/02/2020,3,2,2020,0,0,Australia,AU,AUS,24992369,2020-02-03,11,0,2.0,0.0,1,1,6289,57,4
542,04/02/2020,4,2,2020,0,0,Australia,AU,AUS,24992369,2020-02-04,11,0,0.0,0.0,1,1,6289,57,4
541,05/02/2020,5,2,2020,1,0,Australia,AU,AUS,24992369,2020-02-05,12,0,0.0,0.0,0,1,6289,57,4
540,06/02/2020,6,2,2020,1,0,Australia,AU,AUS,24992369,2020-02-06,13,0,1.0,0.0,1,1,6289,57,4
539,07/02/2020,7,2,2020,1,0,Australia,AU,AUS,24992369,2020-02-07,14,0,1.0,0.0,1,1,6289,57,4
538,08/02/2020,8,2,2020,0,0,Australia,AU,AUS,24992369,2020-02-08,14,0,1.0,0.0,1,1,6289,57,4
537,09/02/2020,9,2,2020,0,0,Australia,AU,AUS,24992369,2020-02-09,14,0,0.0,0.0,1,1,6289,57,4
536,10/02/2020,10,2,2020,0,0,Australia,AU,AUS,24992369,2020-02-10,14,0,0.0,0.0,1,1,6289,57,4
535,11/02/2020,11,2,2020,0,0,Australia,AU,AUS,24992369,2020-02-11,14,0,0.0,0.0,1,1,6289,57,4
534,12/02/2020,12,2,2020,0,0,Australia,AU,AUS,24992369,2020-02-12,14,0,0.0,0.0,1,1,6289,57,4
533,13/02/2020,13,2,2020,0,0,Australia,AU,AUS,24992369,2020-02-13,14,0,0.0,0.0,1,1,6289,57,4
532,14/02/2020,14,2,2020,1,0,Australia,AU,AUS,24992369,2020-02-14,15,0,0.0,0.0,0,1,6289,57,4
531,15/02/2020,15,2,2020,0,0,Australia,AU,AUS,24992369,2020-02-15,15,0,1.0,0.0,1,1,6289,57,4
530,16/02/2020,16,2,2020,0,0,Australia,AU,AUS,24992369,2020-02-16,15,0,0.0,0.0,1,1,6289,57,4
529,17/02/2020,17,2,2020,0,0,Australia,AU,AUS,24992369,2020-02-17,15,0,0.0,0.0,1,1,6289,57,4
528,18/02/2020,18,2,2020,0,0,Australia,AU,AUS,24992369,2020-02-18,15,0,0.0,0.0,1,1,6289,57,4
527,19/02/2020,19,2,2020,0,0,Australia,AU,AUS,24992369,2020-02-19,15,0,0.0,0.0,1,1,6289,57,4
526,20/02/2020,20,2,2020,0,0,Australia,AU,AUS,24992369,2020-02-20,15,0,0.0,0.0,1,1,6289,57,4
525,21/02/2020,21,2,2020,2,0,Australia,AU,AUS,24992369,2020-02-21,17,0,0.0,0.0,0,1,6289,57,4
524,22/02/2020,22,2,2020,4,0,Australia,AU,AUS,24992369,2020-02-22,21,0,2.0,0.0,0,1,6289,57,4
523,23/02/2020,23,2,2020,1,0,Australia,AU,AUS,24992369,2020-02-23,22,0,4.0,0.0,1,1,6289,57,4
522,24/02/2020,24,2,2020,0,0,Australia,AU,AUS,24992369,2020-02-24,22,0,1.0,0.0,1,1,6289,57,4
521,25/02/2020,25,2,2020,0,0,Australia,AU,AUS,24992369,2020-02-25,22,0,0.0,0.0,1,1,6289,57,4
520,26/02/2020,26,2,2020,0,0,Australia,AU,AUS,24992369,2020-02-26,22,0,0.0,0.0,1,1,6289,57,4
519,27/02/2020,27,2,2020,1,0,Australia,AU,AUS,24992369,2020-02-27,23,0,0.0,0.0,0,1,6289,57,4
518,28/02/2020,28,2,2020,0,0,Australia,AU,AUS,24992369,2020-02-28,23,0,1.0,0.0,1,1,6289,57,4
517,29/02/2020,29,2,2020,2,0,Australia,AU,AUS,24992369,2020-02-29,25,0,0.0,0.0,0,1,6289,57,4
516,01/03/2020,1,3,2020,1,1,Australia,AU,AUS,24992369,2020-03-01,26,1,2.0,0.0,1,0,6289,57,4
515,02/03/2020,2,3,2020,3,0,Australia,AU,AUS,24992369,2020-03-02,29,1,1.0,1.0,0,1,6289,57,4
514,03/03/2020,3,3,2020,4,0,Australia,AU,AUS,24992369,2020-03-03,33,1,3.0,0.0,0,1,6289,57,4
513,04/03/2020,4,3,2020,8,0,Australia,AU,AUS,24992369,2020-03-04,41,1,4.0,0.0,0,1,6289,57,4
512,05/03/2020,5,3,2020,11,1,Australia,AU,AUS,24992369,2020-03-05,52,2,8.0,0.0,0,0,6289,57,4
511,06/03/2020,6,3,2020,7,0,Australia,AU,AUS,24992369,2020-03-06,59,2,11.0,1.0,1,1,6289,57,4
510,07/03/2020,7,3,2020,4,0,Australia,AU,AUS,24992369,2020-03-07,63,2,7.0,0.0,1,1,6289,57,4
509,08/03/2020,8,3,2020,11,1,Australia,AU,AUS,24992369,2020-03-08,74,3,4.0,0.0,0,0,6289,57,4
508,09/03/2020,9,3,2020,6,0,Australia,AU,AUS,24992369,2020-03-09,80,3,11.0,1.0,1,1,6289,57,4
507,10/03/2020,10,3,2020,20,0,Australia,AU,AUS,24992369,2020-03-10,100,3,6.0,0.0,0,1,6289,57,4
506,11/03/2020,11,3,2020,12,0,Australia,AU,AUS,24992369,2020-03-11,112,3,20.0,0.0,1,1,6289,57,4
505,12/03/2020,12,3,2020,14,0,Australia,AU,AUS,24992369,2020-03-12,126,3,12.0,0.0,0,1,6289,57,4
504,13/03/2020,13,3,2020,30,0,Australia,AU,AUS,24992369,2020-03-13,156,3,14.0,0.0,0,1,6289,57,4
503,14/03/2020,14,3,2020,41,0,Australia,AU,AUS,24992369,2020-03-14,197,3,30.0,0.0,0,1,6289,57,4
502,15/03/2020,15,3,2020,52,0,Australia,AU,AUS,24992369,2020-03-15,249,3,41.0,0.0,0,1,6289,57,4
501,16/03/2020,16,3,2020,49,2,Australia,AU,AUS,24992369,2020-03-16,298,5,52.0,0.0,1,0,6289,57,4
500,17/03/2020,17,3,2020,77,0,Australia,AU,AUS,24992369,2020-03-17,375,5,49.0,2.0,0,1,6289,57,4
499,18/03/2020,18,3,2020,79,0,Australia,AU,AUS,24992369,2020-03-18,454,5,77.0,0.0,0,1,6289,57,4
498,19/03/2020,19,3,2020,111,1,Australia,AU,AUS,24992369,2020-03-19,565,6,79.0,0.0,0,0,6289,57,4
497,20/03/2020,20,3,2020,144,0,Australia,AU,AUS,24992369,2020-03-20,709,6,111.0,1.0,0,1,6289,57,4
496,21/03/2020,21,3,2020,165,1,Australia,AU,AUS,24992369,2020-03-21,874,7,144.0,0.0,0,0,6289,57,4
495,22/03/2020,22,3,2020,224,0,Australia,AU,AUS,24992369,2020-03-22,1098,7,165.0,1.0,0,1,6289,57,4
494,23/03/2020,23,3,2020,611,0,Australia,AU,AUS,24992369,2020-03-23,1709,7,224.0,0.0,0,1,6289,57,4
493,24/03/2020,24,3,2020,114,0,Australia,AU,AUS,24992369,2020-03-24,1823,7,611.0,0.0,1,1,6289,57,4
492,25/03/2020,25,3,2020,600,1,Australia,AU,AUS,24992369,2020-03-25,2423,8,114.0,0.0,0,0,6289,57,4
491,26/03/2020,26,3,2020,376,3,Australia,AU,AUS,24992369,2020-03-26,2799,11,600.0,1.0,1,0,6289,57,4
490,27/03/2020,27,3,2020,367,2,Australia,AU,AUS,24992369,2020-03-27,3166,13,376.0,3.0,1,1,6289,57,4
489,28/03/2020,28,3,2020,212,0,Australia,AU,AUS,24992369,2020-03-28,3378,13,367.0,2.0,1,1,6289,57,4
488,29/03/2020,29,3,2020,431,1,Australia,AU,AUS,24992369,2020-03-29,3809,14,212.0,0.0,0,0,6289,57,4
487,30/03/2020,30,3,2020,284,2,Australia,AU,AUS,24992369,2020-03-30,4093,16,431.0,1.0,1,0,6289,57,4
486,31/03/2020,31,3,2020,464,3,Australia,AU,AUS,24992369,2020-03-31,4557,19,284.0,2.0,0,0,6289,57,4
485,01/04/2020,1,4,2020,150,1,Australia,AU,AUS,24992369,2020-04-01,4707,20,464.0,3.0,1,1,6289,57,4
484,02/04/2020,2,4,2020,269,1,Australia,AU,AUS,24992369,2020-04-02,4976,21,150.0,1.0,0,1,6289,57,4
483,03/04/2020,3,4,2020,248,2,Australia,AU,AUS,24992369,2020-04-03,5224,23,269.0,1.0,1,0,6289,57,4
482,04/04/2020,4,4,2020,324,7,Australia,AU,AUS,24992369,2020-04-04,5548,30,248.0,2.0,0,0,6289,57,4
481,05/04/2020,5,4,2020,139,4,Australia,AU,AUS,24992369,2020-04-05,5687,34,324.0,7.0,1,1,6289,57,4
480,06/04/2020,6,4,2020,57,2,Australia,AU,AUS,24992369,2020-04-06,5744,36,139.0,4.0,1,1,6289,57,4
479,07/04/2020,7,4,2020,100,6,Australia,AU,AUS,24992369,2020-04-07,5844,42,57.0,2.0,0,0,6289,57,4
478,08/04/2020,8,4,2020,112,3,Australia,AU,AUS,24992369,2020-04-08,5956,45,100.0,6.0,0,1,6289,57,4
477,09/04/2020,9,4,2020,96,5,Australia,AU,AUS,24992369,2020-04-09,6052,50,112.0,3.0,1,0,6289,57,4
476,10/04/2020,10,4,2020,100,2,Australia,AU,AUS,24992369,2020-04-10,6152,52,96.0,5.0,0,1,6289,57,4
475,11/04/2020,11,4,2020,86,2,Australia,AU,AUS,24992369,2020-04-11,6238,54,100.0,2.0,1,1,6289,57,4
474,12/04/2020,12,4,2020,51,3,Australia,AU,AUS,24992369,2020-04-12,6289,57,86.0,2.0,1,0,6289,57,4
681,31/12/2019,31,12,2019,0,0,Austria,AT,AUT,8847037,2019-12-31,0,0,0.0,0.0,1,1,13807,337,4
680,01/01/2020,1,1,2020,0,0,Austria,AT,AUT,8847037,2020-01-01,0,0,0.0,0.0,1,1,13807,337,4
679,02/01/2020,2,1,2020,0,0,Austria,AT,AUT,8847037,2020-01-02,0,0,0.0,0.0,1,1,13807,337,4
678,03/01/2020,3,1,2020,0,0,Austria,AT,AUT,8847037,2020-01-03,0,0,0.0,0.0,1,1,13807,337,4
677,04/01/2020,4,1,2020,0,0,Austria,AT,AUT,8847037,2020-01-04,0,0,0.0,0.0,1,1,13807,337,4
676,05/01/2020,5,1,2020,0,0,Austria,AT,AUT,8847037,2020-01-05,0,0,0.0,0.0,1,1,13807,337,4
675,06/01/2020,6,1,2020,0,0,Austria,AT,AUT,8847037,2020-01-06,0,0,0.0,0.0,1,1,13807,337,4
674,07/01/2020,7,1,2020,0,0,Austria,AT,AUT,8847037,2020-01-07,0,0,0.0,0.0,1,1,13807,337,4
673,08/01/2020,8,1,2020,0,0,Austria,AT,AUT,8847037,2020-01-08,0,0,0.0,0.0,1,1,13807,337,4
672,09/01/2020,9,1,2020,0,0,Austria,AT,AUT,8847037,2020-01-09,0,0,0.0,0.0,1,1,13807,337,4
671,10/01/2020,10,1,2020,0,0,Austria,AT,AUT,8847037,2020-01-10,0,0,0.0,0.0,1,1,13807,337,4
670,11/01/2020,11,1,2020,0,0,Austria,AT,AUT,8847037,2020-01-11,0,0,0.0,0.0,1,1,13807,337,4
669,12/01/2020,12,1,2020,0,0,Austria,AT,AUT,8847037,2020-01-12,0,0,0.0,0.0,1,1,13807,337,4
668,13/01/2020,13,1,2020,0,0,Austria,AT,AUT,8847037,2020-01-13,0,0,0.0,0.0,1,1,13807,337,4
667,14/01/2020,14,1,2020,0,0,Austria,AT,AUT,8847037,2020-01-14,0,0,0.0,0.0,1,1,13807,337,4
666,15/01/2020,15,1,2020,0,0,Austria,AT,AUT,8847037,2020-01-15,0,0,0.0,0.0,1,1,13807,337,4
665,16/01/2020,16,1,2020,0,0,Austria,AT,AUT,8847037,2020-01-16,0,0,0.0,0.0,1,1,13807,337,4
664,17/01/2020,17,1,2020,0,0,Austria,AT,AUT,8847037,2020-01-17,0,0,0.0,0.0,1,1,13807,337,4
663,18/01/2020,18,1,2020,0,0,Austria,AT,AUT,8847037,2020-01-18,0,0,0.0,0.0,1,1,13807,337,4
662,19/01/2020,19,1,2020,0,0,Austria,AT,AUT,8847037,2020-01-19,0,0,0.0,0.0,1,1,13807,337,4
661,20/01/2020,20,1,2020,0,0,Austria,AT,AUT,8847037,2020-01-20,0,0,0.0,0.0,1,1,13807,337,4
660,21/01/2020,21,1,2020,0,0,Austria,AT,AUT,8847037,2020-01-21,0,0,0.0,0.0,1,1,13807,337,4
659,22/01/2020,22,1,2020,0,0,Austria,AT,AUT,8847037,2020-01-22,0,0,0.0,0.0,1,1,13807,337,4
658,23/01/2020,23,1,2020,0,0,Austria,AT,AUT,8847037,2020-01-23,0,0,0.0,0.0,1,1,13807,337,4
657,24/01/2020,24,1,2020,0,0,Austria,AT,AUT,8847037,2020-01-24,0,0,0.0,0.0,1,1,13807,337,4
656,25/01/2020,25,1,2020,0,0,Austria,AT,AUT,8847037,2020-01-25,0,0,0.0,0.0,1,1,13807,337,4
655,26/01/2020,26,1,2020,0,0,Austria,AT,AUT,8847037,2020-01-26,0,0,0.0,0.0,1,1,13807,337,4
654,27/01/2020,27,1,2020,0,0,Austria,AT,AUT,8847037,2020-01-27,0,0,0.0,0.0,1,1,13807,337,4
653,28/01/2020,28,1,2020,0,0,Austria,AT,AUT,8847037,2020-01-28,0,0,0.0,0.0,1,1,13807,337,4
652,29/01/2020,29,1,2020,0,0,Austria,AT,AUT,8847037,2020-01-29,0,0,0.0,0.0,1,1,13807,337,4
651,30/01/2020,30,1,2020,0,0,Austria,AT,AUT,8847037,2020-01-30,0,0,0.0,0.0,1,1,13807,337,4
650,31/01/2020,31,1,2020,0,0,Austria,AT,AUT,8847037,2020-01-31,0,0,0.0,0.0,1,1,13807,337,4
649,01/02/2020,1,2,2020,0,0,Austria,AT,AUT,8847037,2020-02-01,0,0,0.0,0.0,1,1,13807,337,4
648,02/02/2020,2,2,2020,0,0,Austria,AT,AUT,8847037,2020-02-02,0,0,0.0,0.0,1,1,13807,337,4
647,03/02/2020,3,2,2020,0,0,Austria,AT,AUT,8847037,2020-02-03,0,0,0.0,0.0,1,1,13807,337,4
646,04/02/2020,4,2,2020,0,0,Austria,AT,AUT,8847037,2020-02-04,0,0,0.0,0.0,1,1,13807,337,4
645,05/02/2020,5,2,2020,0,0,Austria,AT,AUT,8847037,2020-02-05,0,0,0.0,0.0,1,1,13807,337,4
644,06/02/2020,6,2,2020,0,0,Austria,AT,AUT,8847037,2020-02-06,0,0,0.0,0.0,1,1,13807,337,4
643,07/02/2020,7,2,2020,0,0,Austria,AT,AUT,8847037,2020-02-07,0,0,0.0,0.0,1,1,13807,337,4
642,08/02/2020,8,2,2020,0,0,Austria,AT,AUT,8847037,2020-02-08,0,0,0.0,0.0,1,1,13807,337,4
641,09/02/2020,9,2,2020,0,0,Austria,AT,AUT,8847037,2020-02-09,0,0,0.0,0.0,1,1,13807,337,4
640,10/02/2020,10,2,2020,0,0,Austria,AT,AUT,8847037,2020-02-10,0,0,0.0,0.0,1,1,13807,337,4
639,11/02/2020,11,2,2020,0,0,Austria,AT,AUT,8847037,2020-02-11,0,0,0.0,0.0,1,1,13807,337,4
638,12/02/2020,12,2,2020,0,0,Austria,AT,AUT,8847037,2020-02-12,0,0,0.0,0.0,1,1,13807,337,4
637,13/02/2020,13,2,2020,0,0,Austria,AT,AUT,8847037,2020-02-13,0,0,0.0,0.0,1,1,13807,337,4
636,14/02/2020,14,2,2020,0,0,Austria,AT,AUT,8847037,2020-02-14,0,0,0.0,0.0,1,1,13807,337,4
635,15/02/2020,15,2,2020,0,0,Austria,AT,AUT,8847037,2020-02-15,0,0,0.0,0.0,1,1,13807,337,4
634,16/02/2020,16,2,2020,0,0,Austria,AT,AUT,8847037,2020-02-16,0,0,0.0,0.0,1,1,13807,337,4
633,17/02/2020,17,2,2020,0,0,Austria,AT,AUT,8847037,2020-02-17,0,0,0.0,0.0,1,1,13807,337,4
632,18/02/2020,18,2,2020,0,0,Austria,AT,AUT,8847037,2020-02-18,0,0,0.0,0.0,1,1,13807,337,4
631,19/02/2020,19,2,2020,0,0,Austria,AT,AUT,8847037,2020-02-19,0,0,0.0,0.0,1,1,13807,337,4
630,20/02/2020,20,2,2020,0,0,Austria,AT,AUT,8847037,2020-02-20,0,0,0.0,0.0,1,1,13807,337,4
629,21/02/2020,21,2,2020,0,0,Austria,AT,AUT,8847037,2020-02-21,0,0,0.0,0.0,1,1,13807,337,4
628,22/02/2020,22,2,2020,0,0,Austria,AT,AUT,8847037,2020-02-22,0,0,0.0,0.0,1,1,13807,337,4
627,23/02/2020,23,2,2020,0,0,Austria,AT,AUT,8847037,2020-02-23,0,0,0.0,0.0,1,1,13807,337,4
626,24/02/2020,24,2,2020,0,0,Austria,AT,AUT,8847037,2020-02-24,0,0,0.0,0.0,1,1,13807,337,4
625,25/02/2020,25,2,2020,0,0,Austria,AT,AUT,8847037,2020-02-25,0,0,0.0,0.0,1,1,13807,337,4
624,26/02/2020,26,2,2020,2,0,Austria,AT,AUT,8847037,2020-02-26,2,0,0.0,0.0,0,1,13807,337,4
623,27/02/2020,27,2,2020,0,0,Austria,AT,AUT,8847037,2020-02-27,2,0,2.0,0.0,1,1,13807,337,4
622,28/02/2020,28,2,2020,3,0,Austria,AT,AUT,8847037,2020-02-28,5,0,0.0,0.0,0,1,13807,337,4
621,29/02/2020,29,2,2020,2,0,Austria,AT,AUT,8847037,2020-02-29,7,0,3.0,0.0,1,1,13807,337,4
620,01/03/2020,1,3,2020,3,0,Austria,AT,AUT,8847037,2020-03-01,10,0,2.0,0.0,0,1,13807,337,4
619,02/03/2020,2,3,2020,4,0,Austria,AT,AUT,8847037,2020-03-02,14,0,3.0,0.0,0,1,13807,337,4
618,03/03/2020,3,3,2020,4,0,Austria,AT,AUT,8847037,2020-03-03,18,0,4.0,0.0,1,1,13807,337,4
617,04/03/2020,4,3,2020,6,0,Austria,AT,AUT,8847037,2020-03-04,24,0,4.0,0.0,0,1,13807,337,4
616,05/03/2020,5,3,2020,5,0,Austria,AT,AUT,8847037,2020-03-05,29,0,6.0,0.0,1,1,13807,337,4
615,06/03/2020,6,3,2020,12,0,Austria,AT,AUT,8847037,2020-03-06,41,0,5.0,0.0,0,1,13807,337,4
614,07/03/2020,7,3,2020,33,0,Austria,AT,AUT,8847037,2020-03-07,74,0,12.0,0.0,0,1,13807,337,4
613,08/03/2020,8,3,2020,25,0,Austria,AT,AUT,8847037,2020-03-08,99,0,33.0,0.0,1,1,13807,337,4
612,09/03/2020,9,3,2020,3,0,Austria,AT,AUT,8847037,2020-03-09,102,0,25.0,0.0,1,1,13807,337,4
611,10/03/2020,10,3,2020,29,0,Austria,AT,AUT,8847037,2020-03-10,131,0,3.0,0.0,0,1,13807,337,4
610,11/03/2020,11,3,2020,51,0,Austria,AT,AUT,8847037,2020-03-11,182,0,29.0,0.0,0,1,13807,337,4
609,12/03/2020,12,3,2020,64,0,Austria,AT,AUT,8847037,2020-03-12,246,0,51.0,0.0,0,1,13807,337,4
608,13/03/2020,13,3,2020,115,1,Austria,AT,AUT,8847037,2020-03-13,361,1,64.0,0.0,0,0,13807,337,4
607,14/03/2020,14,3,2020,143,0,Austria,AT,AUT,8847037,2020-03-14,504,1,115.0,1.0,0,1,13807,337,4
606,15/03/2020,15,3,2020,151,0,Austria,AT,AUT,8847037,2020-03-15,655,1,143.0,0.0,0,1,13807,337,4
605,16/03/2020,16,3,2020,205,0,Austria,AT,AUT,8847037,2020-03-16,860,1,151.0,0.0,0,1,13807,337,4
604,17/03/2020,17,3,2020,156,2,Austria,AT,AUT,8847037,2020-03-17,1016,3,205.0,0.0,1,0,13807,337,4
603,18/03/2020,18,3,2020,316,0,Austria,AT,AUT,8847037,2020-03-18,1332,3,156.0,2.0,0,1,13807,337,4
602,19/03/2020,19,3,2020,314,1,Austria,AT,AUT,8847037,2020-03-19,1646,4,316.0,0.0,1,0,13807,337,4
601,20/03/2020,20,3,2020,550,2,Austria,AT,AUT,8847037,2020-03-20,2196,6,314.0,1.0,0,0,13807,337,4
600,21/03/2020,21,3,2020,453,0,Austria,AT,AUT,8847037,2020-03-21,2649,6,550.0,2.0,1,1,13807,337,4
599,22/03/2020,22,3,2020,375,2,Austria,AT,AUT,8847037,2020-03-22,3024,8,453.0,0.0,1,0,13807,337,4
598,23/03/2020,23,3,2020,607,8,Austria,AT,AUT,8847037,2020-03-23,3631,16,375.0,2.0,0,0,13807,337,4
597,24/03/2020,24,3,2020,855,9,Austria,AT,AUT,8847037,2020-03-24,4486,25,607.0,8.0,0,0,13807,337,4
596,25/03/2020,25,3,2020,796,5,Austria,AT,AUT,8847037,2020-03-25,5282,30,855.0,9.0,1,1,13807,337,4
595,26/03/2020,26,3,2020,606,4,Austria,AT,AUT,8847037,2020-03-26,5888,34,796.0,5.0,1,1,13807,337,4
594,27/03/2020,27,3,2020,1141,18,Austria,AT,AUT,8847037,2020-03-27,7029,52,606.0,4.0,0,0,13807,337,4
593,28/03/2020,28,3,2020,668,16,Austria,AT,AUT,8847037,2020-03-28,7697,68,1141.0,18.0,1,1,13807,337,4
592,29/03/2020,29,3,2020,594,0,Austria,AT,AUT,8847037,2020-03-29,8291,68,668.0,16.0,1,1,13807,337,4
591,30/03/2020,30,3,2020,522,18,Austria,AT,AUT,8847037,2020-03-30,8813,86,594.0,0.0,1,0,13807,337,4
590,31/03/2020,31,3,2020,805,22,Austria,AT,AUT,8847037,2020-03-31,9618,108,522.0,18.0,0,0,13807,337,4
589,01/04/2020,1,4,2020,564,20,Austria,AT,AUT,8847037,2020-04-01,10182,128,805.0,22.0,1,1,13807,337,4
588,02/04/2020,2,4,2020,529,18,Austria,AT,AUT,8847037,2020-04-02,10711,146,564.0,20.0,1,1,13807,337,4
587,03/04/2020,3,4,2020,418,12,Austria,AT,AUT,8847037,2020-04-03,11129,158,529.0,18.0,1,1,13807,337,4
586,04/04/2020,4,4,2020,396,10,Austria,AT,AUT,8847037,2020-04-04,11525,168,418.0,12.0,1,1,13807,337,4
585,05/04/2020,5,4,2020,241,18,Austria,AT,AUT,8847037,2020-04-05,11766,186,396.0,10.0,1,0,13807,337,4
584,06/04/2020,6,4,2020,217,18,Austria,AT,AUT,8847037,2020-04-06,11983,204,241.0,18.0,1,1,13807,337,4
583,07/04/2020,7,4,2020,314,16,Austria,AT,AUT,8847037,2020-04-07,12297,220,217.0,18.0,0,1,13807,337,4
582,08/04/2020,8,4,2020,343,23,Austria,AT,AUT,8847037,2020-04-08,12640,243,314.0,16.0,0,0,13807,337,4
581,09/04/2020,9,4,2020,329,30,Austria,AT,AUT,8847037,2020-04-09,12969,273,343.0,23.0,1,0,13807,337,4
580,10/04/2020,10,4,2020,279,22,Austria,AT,AUT,8847037,2020-04-10,13248,295,329.0,30.0,1,1,13807,337,4
579,11/04/2020,11,4,2020,312,24,Austria,AT,AUT,8847037,2020-04-11,13560,319,279.0,22.0,0,0,13807,337,4
578,12/04/2020,12,4,2020,247,18,Austria,AT,AUT,8847037,2020-04-12,13807,337,312.0,24.0,1,1,13807,337,4
778,31/12/2019,31,12,2019,0,0,Azerbaijan,AZ,AZE,9942334,2019-12-31,0,0,0.0,0.0,1,1,1058,11,4
777,01/01/2020,1,1,2020,0,0,Azerbaijan,AZ,AZE,9942334,2020-01-01,0,0,0.0,0.0,1,1,1058,11,4
776,02/01/2020,2,1,2020,0,0,Azerbaijan,AZ,AZE,9942334,2020-01-02,0,0,0.0,0.0,1,1,1058,11,4
775,03/01/2020,3,1,2020,0,0,Azerbaijan,AZ,AZE,9942334,2020-01-03,0,0,0.0,0.0,1,1,1058,11,4
774,04/01/2020,4,1,2020,0,0,Azerbaijan,AZ,AZE,9942334,2020-01-04,0,0,0.0,0.0,1,1,1058,11,4
773,05/01/2020,5,1,2020,0,0,Azerbaijan,AZ,AZE,9942334,2020-01-05,0,0,0.0,0.0,1,1,1058,11,4
772,06/01/2020,6,1,2020,0,0,Azerbaijan,AZ,AZE,9942334,2020-01-06,0,0,0.0,0.0,1,1,1058,11,4
771,07/01/2020,7,1,2020,0,0,Azerbaijan,AZ,AZE,9942334,2020-01-07,0,0,0.0,0.0,1,1,1058,11,4
770,08/01/2020,8,1,2020,0,0,Azerbaijan,AZ,AZE,9942334,2020-01-08,0,0,0.0,0.0,1,1,1058,11,4
769,09/01/2020,9,1,2020,0,0,Azerbaijan,AZ,AZE,9942334,2020-01-09,0,0,0.0,0.0,1,1,1058,11,4
768,10/01/2020,10,1,2020,0,0,Azerbaijan,AZ,AZE,9942334,2020-01-10,0,0,0.0,0.0,1,1,1058,11,4
767,11/01/2020,11,1,2020,0,0,Azerbaijan,AZ,AZE,9942334,2020-01-11,0,0,0.0,0.0,1,1,1058,11,4
766,12/01/2020,12,1,2020,0,0,Azerbaijan,AZ,AZE,9942334,2020-01-12,0,0,0.0,0.0,1,1,1058,11,4
765,13/01/2020,13,1,2020,0,0,Azerbaijan,AZ,AZE,9942334,2020-01-13,0,0,0.0,0.0,1,1,1058,11,4
764,14/01/2020,14,1,2020,0,0,Azerbaijan,AZ,AZE,9942334,2020-01-14,0,0,0.0,0.0,1,1,1058,11,4
763,15/01/2020,15,1,2020,0,0,Azerbaijan,AZ,AZE,9942334,2020-01-15,0,0,0.0,0.0,1,1,1058,11,4
762,16/01/2020,16,1,2020,0,0,Azerbaijan,AZ,AZE,9942334,2020-01-16,0,0,0.0,0.0,1,1,1058,11,4
761,17/01/2020,17,1,2020,0,0,Azerbaijan,AZ,AZE,9942334,2020-01-17,0,0,0.0,0.0,1,1,1058,11,4
760,18/01/2020,18,1,2020,0,0,Azerbaijan,AZ,AZE,9942334,2020-01-18,0,0,0.0,0.0,1,1,1058,11,4
759,19/01/2020,19,1,2020,0,0,Azerbaijan,AZ,AZE,9942334,2020-01-19,0,0,0.0,0.0,1,1,1058,11,4
758,20/01/2020,20,1,2020,0,0,Azerbaijan,AZ,AZE,9942334,2020-01-20,0,0,0.0,0.0,1,1,1058,11,4
757,21/01/2020,21,1,2020,0,0,Azerbaijan,AZ,AZE,9942334,2020-01-21,0,0,0.0,0.0,1,1,1058,11,4
756,22/01/2020,22,1,2020,0,0,Azerbaijan,AZ,AZE,9942334,2020-01-22,0,0,0.0,0.0,1,1,1058,11,4
755,23/01/2020,23,1,2020,0,0,Azerbaijan,AZ,AZE,9942334,2020-01-23,0,0,0.0,0.0,1,1,1058,11,4
754,24/01/2020,24,1,2020,0,0,Azerbaijan,AZ,AZE,9942334,2020-01-24,0,0,0.0,0.0,1,1,1058,11,4
753,25/01/2020,25,1,2020,0,0,Azerbaijan,AZ,AZE,9942334,2020-01-25,0,0,0.0,0.0,1,1,1058,11,4
752,26/01/2020,26,1,2020,0,0,Azerbaijan,AZ,AZE,9942334,2020-01-26,0,0,0.0,0.0,1,1,1058,11,4
751,27/01/2020,27,1,2020,0,0,Azerbaijan,AZ,AZE,9942334,2020-01-27,0,0,0.0,0.0,1,1,1058,11,4
750,28/01/2020,28,1,2020,0,0,Azerbaijan,AZ,AZE,9942334,2020-01-28,0,0,0.0,0.0,1,1,1058,11,4
749,29/01/2020,29,1,2020,0,0,Azerbaijan,AZ,AZE,9942334,2020-01-29,0,0,0.0,0.0,1,1,1058,11,4
748,30/01/2020,30,1,2020,0,0,Azerbaijan,AZ,AZE,9942334,2020-01-30,0,0,0.0,0.0,1,1,1058,11,4
747,31/01/2020,31,1,2020,0,0,Azerbaijan,AZ,AZE,9942334,2020-01-31,0,0,0.0,0.0,1,1,1058,11,4
746,01/02/2020,1,2,2020,0,0,Azerbaijan,AZ,AZE,9942334,2020-02-01,0,0,0.0,0.0,1,1,1058,11,4
745,02/02/2020,2,2,2020,0,0,Azerbaijan,AZ,AZE,9942334,2020-02-02,0,0,0.0,0.0,1,1,1058,11,4
744,03/02/2020,3,2,2020,0,0,Azerbaijan,AZ,AZE,9942334,2020-02-03,0,0,0.0,0.0,1,1,1058,11,4
743,04/02/2020,4,2,2020,0,0,Azerbaijan,AZ,AZE,9942334,2020-02-04,0,0,0.0,0.0,1,1,1058,11,4
742,05/02/2020,5,2,2020,0,0,Azerbaijan,AZ,AZE,9942334,2020-02-05,0,0,0.0,0.0,1,1,1058,11,4
741,06/02/2020,6,2,2020,0,0,Azerbaijan,AZ,AZE,9942334,2020-02-06,0,0,0.0,0.0,1,1,1058,11,4
740,07/02/2020,7,2,2020,0,0,Azerbaijan,AZ,AZE,9942334,2020-02-07,0,0,0.0,0.0,1,1,1058,11,4
739,08/02/2020,8,2,2020,0,0,Azerbaijan,AZ,AZE,9942334,2020-02-08,0,0,0.0,0.0,1,1,1058,11,4
738,09/02/2020,9,2,2020,0,0,Azerbaijan,AZ,AZE,9942334,2020-02-09,0,0,0.0,0.0,1,1,1058,11,4
737,10/02/2020,10,2,2020,0,0,Azerbaijan,AZ,AZE,9942334,2020-02-10,0,0,0.0,0.0,1,1,1058,11,4
736,11/02/2020,11,2,2020,0,0,Azerbaijan,AZ,AZE,9942334,2020-02-11,0,0,0.0,0.0,1,1,1058,11,4
735,12/02/2020,12,2,2020,0,0,Azerbaijan,AZ,AZE,9942334,2020-02-12,0,0,0.0,0.0,1,1,1058,11,4
734,13/02/2020,13,2,2020,0,0,Azerbaijan,AZ,AZE,9942334,2020-02-13,0,0,0.0,0.0,1,1,1058,11,4
733,14/02/2020,14,2,2020,0,0,Azerbaijan,AZ,AZE,9942334,2020-02-14,0,0,0.0,0.0,1,1,1058,11,4
732,15/02/2020,15,2,2020,0,0,Azerbaijan,AZ,AZE,9942334,2020-02-15,0,0,0.0,0.0,1,1,1058,11,4
731,16/02/2020,16,2,2020,0,0,Azerbaijan,AZ,AZE,9942334,2020-02-16,0,0,0.0,0.0,1,1,1058,11,4
730,17/02/2020,17,2,2020,0,0,Azerbaijan,AZ,AZE,9942334,2020-02-17,0,0,0.0,0.0,1,1,1058,11,4
729,18/02/2020,18,2,2020,0,0,Azerbaijan,AZ,AZE,9942334,2020-02-18,0,0,0.0,0.0,1,1,1058,11,4
728,19/02/2020,19,2,2020,0,0,Azerbaijan,AZ,AZE,9942334,2020-02-19,0,0,0.0,0.0,1,1,1058,11,4
727,20/02/2020,20,2,2020,0,0,Azerbaijan,AZ,AZE,9942334,2020-02-20,0,0,0.0,0.0,1,1,1058,11,4
726,21/02/2020,21,2,2020,0,0,Azerbaijan,AZ,AZE,9942334,2020-02-21,0,0,0.0,0.0,1,1,1058,11,4
725,22/02/2020,22,2,2020,0,0,Azerbaijan,AZ,AZE,9942334,2020-02-22,0,0,0.0,0.0,1,1,1058,11,4
724,23/02/2020,23,2,2020,0,0,Azerbaijan,AZ,AZE,9942334,2020-02-23,0,0,0.0,0.0,1,1,1058,11,4
723,24/02/2020,24,2,2020,0,0,Azerbaijan,AZ,AZE,9942334,2020-02-24,0,0,0.0,0.0,1,1,1058,11,4
722,25/02/2020,25,2,2020,0,0,Azerbaijan,AZ,AZE,9942334,2020-02-25,0,0,0.0,0.0,1,1,1058,11,4
721,26/02/2020,26,2,2020,0,0,Azerbaijan,AZ,AZE,9942334,2020-02-26,0,0,0.0,0.0,1,1,1058,11,4
720,27/02/2020,27,2,2020,0,0,Azerbaijan,AZ,AZE,9942334,2020-02-27,0,0,0.0,0.0,1,1,1058,11,4
719,28/02/2020,28,2,2020,0,0,Azerbaijan,AZ,AZE,9942334,2020-02-28,0,0,0.0,0.0,1,1,1058,11,4
718,29/02/2020,29,2,2020,1,0,Azerbaijan,AZ,AZE,9942334,2020-02-29,1,0,0.0,0.0,0,1,1058,11,4
717,01/03/2020,1,3,2020,0,0,Azerbaijan,AZ,AZE,9942334,2020-03-01,1,0,1.0,0.0,1,1,1058,11,4
716,02/03/2020,2,3,2020,2,0,Azerbaijan,AZ,AZE,9942334,2020-03-02,3,0,0.0,0.0,0,1,1058,11,4
715,06/03/2020,6,3,2020,3,0,Azerbaijan,AZ,AZE,9942334,2020-03-06,6,0,2.0,0.0,0,1,1058,11,4
714,07/03/2020,7,3,2020,3,0,Azerbaijan,AZ,AZE,9942334,2020-03-07,9,0,3.0,0.0,1,1,1058,11,4
713,11/03/2020,11,3,2020,2,0,Azerbaijan,AZ,AZE,9942334,2020-03-11,11,0,3.0,0.0,1,1,1058,11,4
712,12/03/2020,12,3,2020,2,0,Azerbaijan,AZ,AZE,9942334,2020-03-12,13,0,2.0,0.0,1,1,1058,11,4
711,13/03/2020,13,3,2020,0,0,Azerbaijan,AZ,AZE,9942334,2020-03-13,13,0,2.0,0.0,1,1,1058,11,4
710,15/03/2020,15,3,2020,6,0,Azerbaijan,AZ,AZE,9942334,2020-03-15,19,0,0.0,0.0,0,1,1058,11,4
709,16/03/2020,16,3,2020,0,0,Azerbaijan,AZ,AZE,9942334,2020-03-16,19,0,6.0,0.0,1,1,1058,11,4
708,17/03/2020,17,3,2020,0,0,Azerbaijan,AZ,AZE,9942334,2020-03-17,19,0,0.0,0.0,1,1,1058,11,4
707,18/03/2020,18,3,2020,9,0,Azerbaijan,AZ,AZE,9942334,2020-03-18,28,0,0.0,0.0,0,1,1058,11,4
706,19/03/2020,19,3,2020,6,0,Azerbaijan,AZ,AZE,9942334,2020-03-19,34,0,9.0,0.0,1,1,1058,11,4
705,20/03/2020,20,3,2020,10,0,Azerbaijan,AZ,AZE,9942334,2020-03-20,44,0,6.0,0.0,0,1,1058,11,4
704,21/03/2020,21,3,2020,0,1,Azerbaijan,AZ,AZE,9942334,2020-03-21,44,1,10.0,0.0,1,0,1058,11,4
703,22/03/2020,22,3,2020,9,0,Azerbaijan,AZ,AZE,9942334,2020-03-22,53,1,0.0,1.0,0,1,1058,11,4
702,23/03/2020,23,3,2020,12,0,Azerbaijan,AZ,AZE,9942334,2020-03-23,65,1,9.0,0.0,0,1,1058,11,4
701,24/03/2020,24,3,2020,7,0,Azerbaijan,AZ,AZE,9942334,2020-03-24,72,1,12.0,0.0,1,1,1058,11,4
700,25/03/2020,25,3,2020,15,0,Azerbaijan,AZ,AZE,9942334,2020-03-25,87,1,7.0,0.0,0,1,1058,11,4
699,26/03/2020,26,3,2020,6,1,Azerbaijan,AZ,AZE,9942334,2020-03-26,93,2,15.0,0.0,1,0,1058,11,4
698,27/03/2020,27,3,2020,29,1,Azerbaijan,AZ,AZE,9942334,2020-03-27,122,3,6.0,1.0,0,1,1058,11,4
697,28/03/2020,28,3,2020,43,0,Azerbaijan,AZ,AZE,9942334,2020-03-28,165,3,29.0,1.0,0,1,1058,11,4
696,29/03/2020,29,3,2020,17,1,Azerbaijan,AZ,AZE,9942334,2020-03-29,182,4,43.0,0.0,1,0,1058,11,4
695,30/03/2020,30,3,2020,27,0,Azerbaijan,AZ,AZE,9942334,2020-03-30,209,4,17.0,1.0,0,1,1058,11,4
694,31/03/2020,31,3,2020,64,0,Azerbaijan,AZ,AZE,9942334,2020-03-31,273,4,27.0,0.0,0,1,1058,11,4
693,01/04/2020,1,4,2020,25,1,Azerbaijan,AZ,AZE,9942334,2020-04-01,298,5,64.0,0.0,1,0,1058,11,4
692,02/04/2020,2,4,2020,61,0,Azerbaijan,AZ,AZE,9942334,2020-04-02,359,5,25.0,1.0,0,1,1058,11,4
691,03/04/2020,3,4,2020,41,0,Azerbaijan,AZ,AZE,9942334,2020-04-03,400,5,61.0,0.0,1,1,1058,11,4
690,04/04/2020,4,4,2020,43,0,Azerbaijan,AZ,AZE,9942334,2020-04-04,443,5,41.0,0.0,0,1,1058,11,4
689,05/04/2020,5,4,2020,78,0,Azerbaijan,AZ,AZE,9942334,2020-04-05,521,5,43.0,0.0,0,1,1058,11,4
688,06/04/2020,6,4,2020,63,2,Azerbaijan,AZ,AZE,9942334,2020-04-06,584,7,78.0,0.0,1,0,1058,11,4
687,07/04/2020,7,4,2020,57,0,Azerbaijan,AZ,AZE,9942334,2020-04-07,641,7,63.0,2.0,1,1,1058,11,4
686,08/04/2020,8,4,2020,76,1,Azerbaijan,AZ,AZE,9942334,2020-04-08,717,8,57.0,0.0,0,0,1058,11,4
685,09/04/2020,9,4,2020,105,0,Azerbaijan,AZ,AZE,9942334,2020-04-09,822,8,76.0,1.0,0,1,1058,11,4
684,10/04/2020,10,4,2020,104,1,Azerbaijan,AZ,AZE,9942334,2020-04-10,926,9,105.0,0.0,1,0,1058,11,4
683,11/04/2020,11,4,2020,65,1,Azerbaijan,AZ,AZE,9942334,2020-04-11,991,10,104.0,1.0,1,1,1058,11,4
682,12/04/2020,12,4,2020,67,1,Azerbaijan,AZ,AZE,9942334,2020-04-12,1058,11,65.0,1.0,0,1,1058,11,4
804,16/03/2020,16,3,2020,1,0,Bahamas,BS,BHS,385640,2020-03-16,1,0,0.0,0.0,0,1,46,8,4
803,17/03/2020,17,3,2020,0,0,Bahamas,BS,BHS,385640,2020-03-17,1,0,1.0,0.0,1,1,46,8,4
802,20/03/2020,20,3,2020,2,0,Bahamas,BS,BHS,385640,2020-03-20,3,0,0.0,0.0,0,1,46,8,4
801,21/03/2020,21,3,2020,1,0,Bahamas,BS,BHS,385640,2020-03-21,4,0,2.0,0.0,1,1,46,8,4
800,22/03/2020,22,3,2020,0,0,Bahamas,BS,BHS,385640,2020-03-22,4,0,1.0,0.0,1,1,46,8,4
799,23/03/2020,23,3,2020,0,0,Bahamas,BS,BHS,385640,2020-03-23,4,0,0.0,0.0,1,1,46,8,4
798,24/03/2020,24,3,2020,0,0,Bahamas,BS,BHS,385640,2020-03-24,4,0,0.0,0.0,1,1,46,8,4
797,25/03/2020,25,3,2020,0,0,Bahamas,BS,BHS,385640,2020-03-25,4,0,0.0,0.0,1,1,46,8,4
796,26/03/2020,26,3,2020,1,0,Bahamas,BS,BHS,385640,2020-03-26,5,0,0.0,0.0,0,1,46,8,4
795,27/03/2020,27,3,2020,4,0,Bahamas,BS,BHS,385640,2020-03-27,9,0,1.0,0.0,0,1,46,8,4
794,28/03/2020,28,3,2020,0,0,Bahamas,BS,BHS,385640,2020-03-28,9,0,4.0,0.0,1,1,46,8,4
793,29/03/2020,29,3,2020,2,0,Bahamas,BS,BHS,385640,2020-03-29,11,0,0.0,0.0,0,1,46,8,4
792,30/03/2020,30,3,2020,3,0,Bahamas,BS,BHS,385640,2020-03-30,14,0,2.0,0.0,0,1,46,8,4
791,31/03/2020,31,3,2020,0,0,Bahamas,BS,BHS,385640,2020-03-31,14,0,3.0,0.0,1,1,46,8,4
790,01/04/2020,1,4,2020,1,0,Bahamas,BS,BHS,385640,2020-04-01,15,0,0.0,0.0,0,1,46,8,4
789,02/04/2020,2,4,2020,6,1,Bahamas,BS,BHS,385640,2020-04-02,21,1,1.0,0.0,0,0,46,8,4
788,03/04/2020,3,4,2020,3,0,Bahamas,BS,BHS,385640,2020-04-03,24,1,6.0,1.0,1,1,46,8,4
787,04/04/2020,4,4,2020,0,2,Bahamas,BS,BHS,385640,2020-04-04,24,3,3.0,0.0,1,0,46,8,4
786,05/04/2020,5,4,2020,4,1,Bahamas,BS,BHS,385640,2020-04-05,28,4,0.0,2.0,0,1,46,8,4
785,06/04/2020,6,4,2020,1,1,Bahamas,BS,BHS,385640,2020-04-06,29,5,4.0,1.0,1,1,46,8,4
784,07/04/2020,7,4,2020,4,0,Bahamas,BS,BHS,385640,2020-04-07,33,5,1.0,1.0,0,1,46,8,4
783,08/04/2020,8,4,2020,3,1,Bahamas,BS,BHS,385640,2020-04-08,36,6,4.0,0.0,1,0,46,8,4
782,09/04/2020,9,4,2020,4,1,Bahamas,BS,BHS,385640,2020-04-09,40,7,3.0,1.0,0,1,46,8,4
781,10/04/2020,10,4,2020,1,1,Bahamas,BS,BHS,385640,2020-04-10,41,8,4.0,1.0,1,1,46,8,4
780,11/04/2020,11,4,2020,1,0,Bahamas,BS,BHS,385640,2020-04-11,42,8,1.0,1.0,1,1,46,8,4
779,12/04/2020,12,4,2020,4,0,Bahamas,BS,BHS,385640,2020-04-12,46,8,1.0,0.0,0,1,46,8,4
907,31/12/2019,31,12,2019,0,0,Bahrain,BH,BHR,1569439,2019-12-31,0,0,0.0,0.0,1,1,1040,6,4
906,01/01/2020,1,1,2020,0,0,Bahrain,BH,BHR,1569439,2020-01-01,0,0,0.0,0.0,1,1,1040,6,4
905,02/01/2020,2,1,2020,0,0,Bahrain,BH,BHR,1569439,2020-01-02,0,0,0.0,0.0,1,1,1040,6,4
904,03/01/2020,3,1,2020,0,0,Bahrain,BH,BHR,1569439,2020-01-03,0,0,0.0,0.0,1,1,1040,6,4
903,04/01/2020,4,1,2020,0,0,Bahrain,BH,BHR,1569439,2020-01-04,0,0,0.0,0.0,1,1,1040,6,4
902,05/01/2020,5,1,2020,0,0,Bahrain,BH,BHR,1569439,2020-01-05,0,0,0.0,0.0,1,1,1040,6,4
901,06/01/2020,6,1,2020,0,0,Bahrain,BH,BHR,1569439,2020-01-06,0,0,0.0,0.0,1,1,1040,6,4
900,07/01/2020,7,1,2020,0,0,Bahrain,BH,BHR,1569439,2020-01-07,0,0,0.0,0.0,1,1,1040,6,4
899,08/01/2020,8,1,2020,0,0,Bahrain,BH,BHR,1569439,2020-01-08,0,0,0.0,0.0,1,1,1040,6,4
898,09/01/2020,9,1,2020,0,0,Bahrain,BH,BHR,1569439,2020-01-09,0,0,0.0,0.0,1,1,1040,6,4
897,10/01/2020,10,1,2020,0,0,Bahrain,BH,BHR,1569439,2020-01-10,0,0,0.0,0.0,1,1,1040,6,4
896,11/01/2020,11,1,2020,0,0,Bahrain,BH,BHR,1569439,2020-01-11,0,0,0.0,0.0,1,1,1040,6,4
895,12/01/2020,12,1,2020,0,0,Bahrain,BH,BHR,1569439,2020-01-12,0,0,0.0,0.0,1,1,1040,6,4
894,13/01/2020,13,1,2020,0,0,Bahrain,BH,BHR,1569439,2020-01-13,0,0,0.0,0.0,1,1,1040,6,4
893,14/01/2020,14,1,2020,0,0,Bahrain,BH,BHR,1569439,2020-01-14,0,0,0.0,0.0,1,1,1040,6,4
892,15/01/2020,15,1,2020,0,0,Bahrain,BH,BHR,1569439,2020-01-15,0,0,0.0,0.0,1,1,1040,6,4
891,16/01/2020,16,1,2020,0,0,Bahrain,BH,BHR,1569439,2020-01-16,0,0,0.0,0.0,1,1,1040,6,4
890,17/01/2020,17,1,2020,0,0,Bahrain,BH,BHR,1569439,2020-01-17,0,0,0.0,0.0,1,1,1040,6,4
889,18/01/2020,18,1,2020,0,0,Bahrain,BH,BHR,1569439,2020-01-18,0,0,0.0,0.0,1,1,1040,6,4
888,19/01/2020,19,1,2020,0,0,Bahrain,BH,BHR,1569439,2020-01-19,0,0,0.0,0.0,1,1,1040,6,4
887,20/01/2020,20,1,2020,0,0,Bahrain,BH,BHR,1569439,2020-01-20,0,0,0.0,0.0,1,1,1040,6,4
886,21/01/2020,21,1,2020,0,0,Bahrain,BH,BHR,1569439,2020-01-21,0,0,0.0,0.0,1,1,1040,6,4
885,22/01/2020,22,1,2020,0,0,Bahrain,BH,BHR,1569439,2020-01-22,0,0,0.0,0.0,1,1,1040,6,4
884,23/01/2020,23,1,2020,0,0,Bahrain,BH,BHR,1569439,2020-01-23,0,0,0.0,0.0,1,1,1040,6,4
883,24/01/2020,24,1,2020,0,0,Bahrain,BH,BHR,1569439,2020-01-24,0,0,0.0,0.0,1,1,1040,6,4
882,25/01/2020,25,1,2020,0,0,Bahrain,BH,BHR,1569439,2020-01-25,0,0,0.0,0.0,1,1,1040,6,4
881,26/01/2020,26,1,2020,0,0,Bahrain,BH,BHR,1569439,2020-01-26,0,0,0.0,0.0,1,1,1040,6,4
880,27/01/2020,27,1,2020,0,0,Bahrain,BH,BHR,1569439,2020-01-27,0,0,0.0,0.0,1,1,1040,6,4
879,28/01/2020,28,1,2020,0,0,Bahrain,BH,BHR,1569439,2020-01-28,0,0,0.0,0.0,1,1,1040,6,4
878,29/01/2020,29,1,2020,0,0,Bahrain,BH,BHR,1569439,2020-01-29,0,0,0.0,0.0,1,1,1040,6,4
877,30/01/2020,30,1,2020,0,0,Bahrain,BH,BHR,1569439,2020-01-30,0,0,0.0,0.0,1,1,1040,6,4
876,31/01/2020,31,1,2020,0,0,Bahrain,BH,BHR,1569439,2020-01-31,0,0,0.0,0.0,1,1,1040,6,4
875,01/02/2020,1,2,2020,0,0,Bahrain,BH,BHR,1569439,2020-02-01,0,0,0.0,0.0,1,1,1040,6,4
874,02/02/2020,2,2,2020,0,0,Bahrain,BH,BHR,1569439,2020-02-02,0,0,0.0,0.0,1,1,1040,6,4
873,03/02/2020,3,2,2020,0,0,Bahrain,BH,BHR,1569439,2020-02-03,0,0,0.0,0.0,1,1,1040,6,4
872,04/02/2020,4,2,2020,0,0,Bahrain,BH,BHR,1569439,2020-02-04,0,0,0.0,0.0,1,1,1040,6,4
871,05/02/2020,5,2,2020,0,0,Bahrain,BH,BHR,1569439,2020-02-05,0,0,0.0,0.0,1,1,1040,6,4
870,06/02/2020,6,2,2020,0,0,Bahrain,BH,BHR,1569439,2020-02-06,0,0,0.0,0.0,1,1,1040,6,4
869,07/02/2020,7,2,2020,0,0,Bahrain,BH,BHR,1569439,2020-02-07,0,0,0.0,0.0,1,1,1040,6,4
868,08/02/2020,8,2,2020,0,0,Bahrain,BH,BHR,1569439,2020-02-08,0,0,0.0,0.0,1,1,1040,6,4
867,09/02/2020,9,2,2020,0,0,Bahrain,BH,BHR,1569439,2020-02-09,0,0,0.0,0.0,1,1,1040,6,4
866,10/02/2020,10,2,2020,0,0,Bahrain,BH,BHR,1569439,2020-02-10,0,0,0.0,0.0,1,1,1040,6,4
865,11/02/2020,11,2,2020,0,0,Bahrain,BH,BHR,1569439,2020-02-11,0,0,0.0,0.0,1,1,1040,6,4
864,12/02/2020,12,2,2020,0,0,Bahrain,BH,BHR,1569439,2020-02-12,0,0,0.0,0.0,1,1,1040,6,4
863,13/02/2020,13,2,2020,0,0,Bahrain,BH,BHR,1569439,2020-02-13,0,0,0.0,0.0,1,1,1040,6,4
862,14/02/2020,14,2,2020,0,0,Bahrain,BH,BHR,1569439,2020-02-14,0,0,0.0,0.0,1,1,1040,6,4
861,15/02/2020,15,2,2020,0,0,Bahrain,BH,BHR,1569439,2020-02-15,0,0,0.0,0.0,1,1,1040,6,4
860,16/02/2020,16,2,2020,0,0,Bahrain,BH,BHR,1569439,2020-02-16,0,0,0.0,0.0,1,1,1040,6,4
859,17/02/2020,17,2,2020,0,0,Bahrain,BH,BHR,1569439,2020-02-17,0,0,0.0,0.0,1,1,1040,6,4
858,18/02/2020,18,2,2020,0,0,Bahrain,BH,BHR,1569439,2020-02-18,0,0,0.0,0.0,1,1,1040,6,4
857,19/02/2020,19,2,2020,0,0,Bahrain,BH,BHR,1569439,2020-02-19,0,0,0.0,0.0,1,1,1040,6,4
856,20/02/2020,20,2,2020,0,0,Bahrain,BH,BHR,1569439,2020-02-20,0,0,0.0,0.0,1,1,1040,6,4
855,21/02/2020,21,2,2020,0,0,Bahrain,BH,BHR,1569439,2020-02-21,0,0,0.0,0.0,1,1,1040,6,4
854,22/02/2020,22,2,2020,0,0,Bahrain,BH,BHR,1569439,2020-02-22,0,0,0.0,0.0,1,1,1040,6,4
853,23/02/2020,23,2,2020,0,0,Bahrain,BH,BHR,1569439,2020-02-23,0,0,0.0,0.0,1,1,1040,6,4
852,24/02/2020,24,2,2020,1,0,Bahrain,BH,BHR,1569439,2020-02-24,1,0,0.0,0.0,0,1,1040,6,4
851,25/02/2020,25,2,2020,1,0,Bahrain,BH,BHR,1569439,2020-02-25,2,0,1.0,0.0,1,1,1040,6,4
850,26/02/2020,26,2,2020,21,0,Bahrain,BH,BHR,1569439,2020-02-26,23,0,1.0,0.0,0,1,1040,6,4
849,27/02/2020,27,2,2020,10,0,Bahrain,BH,BHR,1569439,2020-02-27,33,0,21.0,0.0,1,1,1040,6,4
848,28/02/2020,28,2,2020,0,0,Bahrain,BH,BHR,1569439,2020-02-28,33,0,10.0,0.0,1,1,1040,6,4
847,29/02/2020,29,2,2020,5,0,Bahrain,BH,BHR,1569439,2020-02-29,38,0,0.0,0.0,0,1,1040,6,4
846,01/03/2020,1,3,2020,3,0,Bahrain,BH,BHR,1569439,2020-03-01,41,0,5.0,0.0,1,1,1040,6,4
845,02/03/2020,2,3,2020,6,0,Bahrain,BH,BHR,1569439,2020-03-02,47,0,3.0,0.0,0,1,1040,6,4
844,04/03/2020,4,3,2020,2,0,Bahrain,BH,BHR,1569439,2020-03-04,49,0,6.0,0.0,1,1,1040,6,4
843,05/03/2020,5,3,2020,3,0,Bahrain,BH,BHR,1569439,2020-03-05,52,0,2.0,0.0,0,1,1040,6,4
842,06/03/2020,6,3,2020,0,0,Bahrain,BH,BHR,1569439,2020-03-06,52,0,3.0,0.0,1,1,1040,6,4
841,07/03/2020,7,3,2020,4,0,Bahrain,BH,BHR,1569439,2020-03-07,56,0,0.0,0.0,0,1,1040,6,4
840,08/03/2020,8,3,2020,7,0,Bahrain,BH,BHR,1569439,2020-03-08,63,0,4.0,0.0,0,1,1040,6,4
839,09/03/2020,9,3,2020,16,0,Bahrain,BH,BHR,1569439,2020-03-09,79,0,7.0,0.0,0,1,1040,6,4
838,10/03/2020,10,3,2020,30,0,Bahrain,BH,BHR,1569439,2020-03-10,109,0,16.0,0.0,0,1,1040,6,4
837,11/03/2020,11,3,2020,1,0,Bahrain,BH,BHR,1569439,2020-03-11,110,0,30.0,0.0,1,1,1040,6,4
836,12/03/2020,12,3,2020,52,0,Bahrain,BH,BHR,1569439,2020-03-12,162,0,1.0,0.0,0,1,1040,6,4
835,13/03/2020,13,3,2020,0,0,Bahrain,BH,BHR,1569439,2020-03-13,162,0,52.0,0.0,1,1,1040,6,4
834,14/03/2020,14,3,2020,48,0,Bahrain,BH,BHR,1569439,2020-03-14,210,0,0.0,0.0,0,1,1040,6,4
833,15/03/2020,15,3,2020,1,0,Bahrain,BH,BHR,1569439,2020-03-15,211,0,48.0,0.0,1,1,1040,6,4
832,16/03/2020,16,3,2020,3,0,Bahrain,BH,BHR,1569439,2020-03-16,214,0,1.0,0.0,0,1,1040,6,4
831,17/03/2020,17,3,2020,7,1,Bahrain,BH,BHR,1569439,2020-03-17,221,1,3.0,0.0,0,0,1040,6,4
830,18/03/2020,18,3,2020,16,0,Bahrain,BH,BHR,1569439,2020-03-18,237,1,7.0,1.0,0,1,1040,6,4
829,19/03/2020,19,3,2020,19,0,Bahrain,BH,BHR,1569439,2020-03-19,256,1,16.0,0.0,0,1,1040,6,4
828,20/03/2020,20,3,2020,13,0,Bahrain,BH,BHR,1569439,2020-03-20,269,1,19.0,0.0,1,1,1040,6,4
827,21/03/2020,21,3,2020,16,0,Bahrain,BH,BHR,1569439,2020-03-21,285,1,13.0,0.0,0,1,1040,6,4
826,22/03/2020,22,3,2020,21,0,Bahrain,BH,BHR,1569439,2020-03-22,306,1,16.0,0.0,0,1,1040,6,4
825,23/03/2020,23,3,2020,28,1,Bahrain,BH,BHR,1569439,2020-03-23,334,2,21.0,0.0,0,0,1040,6,4
824,24/03/2020,24,3,2020,5,0,Bahrain,BH,BHR,1569439,2020-03-24,339,2,28.0,1.0,1,1,1040,6,4
823,25/03/2020,25,3,2020,51,1,Bahrain,BH,BHR,1569439,2020-03-25,390,3,5.0,0.0,0,0,1040,6,4
822,26/03/2020,26,3,2020,29,0,Bahrain,BH,BHR,1569439,2020-03-26,419,3,51.0,1.0,1,1,1040,6,4
821,27/03/2020,27,3,2020,39,1,Bahrain,BH,BHR,1569439,2020-03-27,458,4,29.0,0.0,0,0,1040,6,4
820,28/03/2020,28,3,2020,8,0,Bahrain,BH,BHR,1569439,2020-03-28,466,4,39.0,1.0,1,1,1040,6,4
819,29/03/2020,29,3,2020,7,0,Bahrain,BH,BHR,1569439,2020-03-29,473,4,8.0,0.0,1,1,1040,6,4
818,30/03/2020,30,3,2020,27,0,Bahrain,BH,BHR,1569439,2020-03-30,500,4,7.0,0.0,0,1,1040,6,4
817,31/03/2020,31,3,2020,15,0,Bahrain,BH,BHR,1569439,2020-03-31,515,4,27.0,0.0,1,1,1040,6,4
816,01/04/2020,1,4,2020,52,0,Bahrain,BH,BHR,1569439,2020-04-01,567,4,15.0,0.0,0,1,1040,6,4
815,02/04/2020,2,4,2020,2,0,Bahrain,BH,BHR,1569439,2020-04-02,569,4,52.0,0.0,1,1,1040,6,4
814,03/04/2020,3,4,2020,74,0,Bahrain,BH,BHR,1569439,2020-04-03,643,4,2.0,0.0,0,1,1040,6,4
813,04/04/2020,4,4,2020,0,0,Bahrain,BH,BHR,1569439,2020-04-04,643,4,74.0,0.0,1,1,1040,6,4
812,05/04/2020,5,4,2020,45,0,Bahrain,BH,BHR,1569439,2020-04-05,688,4,0.0,0.0,0,1,1040,6,4
811,06/04/2020,6,4,2020,12,0,Bahrain,BH,BHR,1569439,2020-04-06,700,4,45.0,0.0,1,1,1040,6,4
810,07/04/2020,7,4,2020,56,0,Bahrain,BH,BHR,1569439,2020-04-07,756,4,12.0,0.0,0,1,1040,6,4
809,08/04/2020,8,4,2020,55,1,Bahrain,BH,BHR,1569439,2020-04-08,811,5,56.0,0.0,1,0,1040,6,4
808,09/04/2020,9,4,2020,12,0,Bahrain,BH,BHR,1569439,2020-04-09,823,5,55.0,1.0,1,1,1040,6,4
807,10/04/2020,10,4,2020,64,0,Bahrain,BH,BHR,1569439,2020-04-10,887,5,12.0,0.0,0,1,1040,6,4
806,11/04/2020,11,4,2020,111,1,Bahrain,BH,BHR,1569439,2020-04-11,998,6,64.0,0.0,0,0,1040,6,4
805,12/04/2020,12,4,2020,42,0,Bahrain,BH,BHR,1569439,2020-04-12,1040,6,111.0,1.0,1,1,1040,6,4
936,09/03/2020,9,3,2020,3,0,Bangladesh,BD,BGD,161356039,2020-03-09,3,0,0.0,0.0,0,1,482,30,2
935,15/03/2020,15,3,2020,0,0,Bangladesh,BD,BGD,161356039,2020-03-15,3,0,3.0,0.0,1,1,482,30,2
934,17/03/2020,17,3,2020,2,0,Bangladesh,BD,BGD,161356039,2020-03-17,5,0,0.0,0.0,0,1,482,30,2
933,18/03/2020,18,3,2020,3,0,Bangladesh,BD,BGD,161356039,2020-03-18,8,0,2.0,0.0,0,1,482,30,2
932,19/03/2020,19,3,2020,2,0,Bangladesh,BD,BGD,161356039,2020-03-19,10,0,3.0,0.0,1,1,482,30,2
931,20/03/2020,20,3,2020,0,0,Bangladesh,BD,BGD,161356039,2020-03-20,10,0,2.0,0.0,1,1,482,30,2
930,21/03/2020,21,3,2020,7,0,Bangladesh,BD,BGD,161356039,2020-03-21,17,0,0.0,0.0,0,1,482,30,2
929,22/03/2020,22,3,2020,7,2,Bangladesh,BD,BGD,161356039,2020-03-22,24,2,7.0,0.0,1,0,482,30,2
928,23/03/2020,23,3,2020,3,1,Bangladesh,BD,BGD,161356039,2020-03-23,27,3,7.0,2.0,1,1,482,30,2
927,24/03/2020,24,3,2020,6,0,Bangladesh,BD,BGD,161356039,2020-03-24,33,3,3.0,1.0,0,1,482,30,2
926,25/03/2020,25,3,2020,6,1,Bangladesh,BD,BGD,161356039,2020-03-25,39,4,6.0,0.0,1,0,482,30,2
925,26/03/2020,26,3,2020,0,1,Bangladesh,BD,BGD,161356039,2020-03-26,39,5,6.0,1.0,1,1,482,30,2
924,27/03/2020,27,3,2020,9,0,Bangladesh,BD,BGD,161356039,2020-03-27,48,5,0.0,1.0,0,1,482,30,2
923,28/03/2020,28,3,2020,0,0,Bangladesh,BD,BGD,161356039,2020-03-28,48,5,9.0,0.0,1,1,482,30,2
922,29/03/2020,29,3,2020,0,0,Bangladesh,BD,BGD,161356039,2020-03-29,48,5,0.0,0.0,1,1,482,30,2
921,30/03/2020,30,3,2020,1,0,Bangladesh,BD,BGD,161356039,2020-03-30,49,5,0.0,0.0,0,1,482,30,2
920,31/03/2020,31,3,2020,0,0,Bangladesh,BD,BGD,161356039,2020-03-31,49,5,1.0,0.0,1,1,482,30,2
919,01/04/2020,1,4,2020,2,0,Bangladesh,BD,BGD,161356039,2020-04-01,51,5,0.0,0.0,0,1,482,30,2
918,02/04/2020,2,4,2020,3,1,Bangladesh,BD,BGD,161356039,2020-04-02,54,6,2.0,0.0,0,0,482,30,2
917,03/04/2020,3,4,2020,2,0,Bangladesh,BD,BGD,161356039,2020-04-03,56,6,3.0,1.0,1,1,482,30,2
916,04/04/2020,4,4,2020,5,0,Bangladesh,BD,BGD,161356039,2020-04-04,61,6,2.0,0.0,0,1,482,30,2
915,05/04/2020,5,4,2020,9,2,Bangladesh,BD,BGD,161356039,2020-04-05,70,8,5.0,0.0,0,0,482,30,2
914,06/04/2020,6,4,2020,18,1,Bangladesh,BD,BGD,161356039,2020-04-06,88,9,9.0,2.0,0,1,482,30,2
913,07/04/2020,7,4,2020,35,3,Bangladesh,BD,BGD,161356039,2020-04-07,123,12,18.0,1.0,0,0,482,30,2
912,08/04/2020,8,4,2020,41,5,Bangladesh,BD,BGD,161356039,2020-04-08,164,17,35.0,3.0,0,0,482,30,2
911,09/04/2020,9,4,2020,54,3,Bangladesh,BD,BGD,161356039,2020-04-09,218,20,41.0,5.0,0,1,482,30,2
910,10/04/2020,10,4,2020,112,1,Bangladesh,BD,BGD,161356039,2020-04-10,330,21,54.0,3.0,0,1,482,30,2
909,11/04/2020,11,4,2020,94,6,Bangladesh,BD,BGD,161356039,2020-04-11,424,27,112.0,1.0,1,0,482,30,2
908,12/04/2020,12,4,2020,58,3,Bangladesh,BD,BGD,161356039,2020-04-12,482,30,94.0,6.0,1,1,482,30,2
962,18/03/2020,18,3,2020,1,0,Barbados,BB,BRB,286641,2020-03-18,1,0,0.0,0.0,0,1,68,4,6
961,19/03/2020,19,3,2020,0,0,Barbados,BB,BRB,286641,2020-03-19,1,0,1.0,0.0,1,1,68,4,6
960,20/03/2020,20,3,2020,1,0,Barbados,BB,BRB,286641,2020-03-20,2,0,0.0,0.0,0,1,68,4,6
959,21/03/2020,21,3,2020,4,0,Barbados,BB,BRB,286641,2020-03-21,6,0,1.0,0.0,0,1,68,4,6
958,22/03/2020,22,3,2020,8,0,Barbados,BB,BRB,286641,2020-03-22,14,0,4.0,0.0,0,1,68,4,6
957,23/03/2020,23,3,2020,3,0,Barbados,BB,BRB,286641,2020-03-23,17,0,8.0,0.0,1,1,68,4,6
956,24/03/2020,24,3,2020,0,0,Barbados,BB,BRB,286641,2020-03-24,17,0,3.0,0.0,1,1,68,4,6
955,25/03/2020,25,3,2020,1,0,Barbados,BB,BRB,286641,2020-03-25,18,0,0.0,0.0,0,1,68,4,6
954,26/03/2020,26,3,2020,0,0,Barbados,BB,BRB,286641,2020-03-26,18,0,1.0,0.0,1,1,68,4,6
953,27/03/2020,27,3,2020,6,0,Barbados,BB,BRB,286641,2020-03-27,24,0,0.0,0.0,0,1,68,4,6
952,28/03/2020,28,3,2020,0,0,Barbados,BB,BRB,286641,2020-03-28,24,0,6.0,0.0,1,1,68,4,6
951,29/03/2020,29,3,2020,2,0,Barbados,BB,BRB,286641,2020-03-29,26,0,0.0,0.0,0,1,68,4,6
950,30/03/2020,30,3,2020,7,0,Barbados,BB,BRB,286641,2020-03-30,33,0,2.0,0.0,0,1,68,4,6
949,31/03/2020,31,3,2020,1,0,Barbados,BB,BRB,286641,2020-03-31,34,0,7.0,0.0,1,1,68,4,6
948,01/04/2020,1,4,2020,0,0,Barbados,BB,BRB,286641,2020-04-01,34,0,1.0,0.0,1,1,68,4,6
947,02/04/2020,2,4,2020,11,0,Barbados,BB,BRB,286641,2020-04-02,45,0,0.0,0.0,0,1,68,4,6
946,03/04/2020,3,4,2020,0,0,Barbados,BB,BRB,286641,2020-04-03,45,0,11.0,0.0,1,1,68,4,6
945,04/04/2020,4,4,2020,0,0,Barbados,BB,BRB,286641,2020-04-04,45,0,0.0,0.0,1,1,68,4,6
944,05/04/2020,5,4,2020,6,0,Barbados,BB,BRB,286641,2020-04-05,51,0,0.0,0.0,0,1,68,4,6
943,06/04/2020,6,4,2020,5,1,Barbados,BB,BRB,286641,2020-04-06,56,1,6.0,0.0,1,0,68,4,6
942,07/04/2020,7,4,2020,4,1,Barbados,BB,BRB,286641,2020-04-07,60,2,5.0,1.0,1,1,68,4,6
941,08/04/2020,8,4,2020,3,1,Barbados,BB,BRB,286641,2020-04-08,63,3,4.0,1.0,1,1,68,4,6
940,09/04/2020,9,4,2020,0,0,Barbados,BB,BRB,286641,2020-04-09,63,3,3.0,1.0,1,1,68,4,6
939,10/04/2020,10,4,2020,3,0,Barbados,BB,BRB,286641,2020-04-10,66,3,0.0,0.0,0,1,68,4,6
938,11/04/2020,11,4,2020,1,1,Barbados,BB,BRB,286641,2020-04-11,67,4,3.0,0.0,1,0,68,4,6
937,12/04/2020,12,4,2020,1,0,Barbados,BB,BRB,286641,2020-04-12,68,4,1.0,1.0,1,1,68,4,6
1058,31/12/2019,31,12,2019,0,0,Belarus,BY,BLR,9485386,2019-12-31,0,0,0.0,0.0,1,1,2226,23,2
1057,01/01/2020,1,1,2020,0,0,Belarus,BY,BLR,9485386,2020-01-01,0,0,0.0,0.0,1,1,2226,23,2
1056,02/01/2020,2,1,2020,0,0,Belarus,BY,BLR,9485386,2020-01-02,0,0,0.0,0.0,1,1,2226,23,2
1055,03/01/2020,3,1,2020,0,0,Belarus,BY,BLR,9485386,2020-01-03,0,0,0.0,0.0,1,1,2226,23,2
1054,04/01/2020,4,1,2020,0,0,Belarus,BY,BLR,9485386,2020-01-04,0,0,0.0,0.0,1,1,2226,23,2
1053,05/01/2020,5,1,2020,0,0,Belarus,BY,BLR,9485386,2020-01-05,0,0,0.0,0.0,1,1,2226,23,2
1052,06/01/2020,6,1,2020,0,0,Belarus,BY,BLR,9485386,2020-01-06,0,0,0.0,0.0,1,1,2226,23,2
1051,07/01/2020,7,1,2020,0,0,Belarus,BY,BLR,9485386,2020-01-07,0,0,0.0,0.0,1,1,2226,23,2
1050,08/01/2020,8,1,2020,0,0,Belarus,BY,BLR,9485386,2020-01-08,0,0,0.0,0.0,1,1,2226,23,2
1049,09/01/2020,9,1,2020,0,0,Belarus,BY,BLR,9485386,2020-01-09,0,0,0.0,0.0,1,1,2226,23,2
1048,10/01/2020,10,1,2020,0,0,Belarus,BY,BLR,9485386,2020-01-10,0,0,0.0,0.0,1,1,2226,23,2
1047,11/01/2020,11,1,2020,0,0,Belarus,BY,BLR,9485386,2020-01-11,0,0,0.0,0.0,1,1,2226,23,2
1046,12/01/2020,12,1,2020,0,0,Belarus,BY,BLR,9485386,2020-01-12,0,0,0.0,0.0,1,1,2226,23,2
1045,13/01/2020,13,1,2020,0,0,Belarus,BY,BLR,9485386,2020-01-13,0,0,0.0,0.0,1,1,2226,23,2
1044,14/01/2020,14,1,2020,0,0,Belarus,BY,BLR,9485386,2020-01-14,0,0,0.0,0.0,1,1,2226,23,2
1043,15/01/2020,15,1,2020,0,0,Belarus,BY,BLR,9485386,2020-01-15,0,0,0.0,0.0,1,1,2226,23,2
1042,16/01/2020,16,1,2020,0,0,Belarus,BY,BLR,9485386,2020-01-16,0,0,0.0,0.0,1,1,2226,23,2
1041,17/01/2020,17,1,2020,0,0,Belarus,BY,BLR,9485386,2020-01-17,0,0,0.0,0.0,1,1,2226,23,2
1040,18/01/2020,18,1,2020,0,0,Belarus,BY,BLR,9485386,2020-01-18,0,0,0.0,0.0,1,1,2226,23,2
1039,19/01/2020,19,1,2020,0,0,Belarus,BY,BLR,9485386,2020-01-19,0,0,0.0,0.0,1,1,2226,23,2
1038,20/01/2020,20,1,2020,0,0,Belarus,BY,BLR,9485386,2020-01-20,0,0,0.0,0.0,1,1,2226,23,2
1037,21/01/2020,21,1,2020,0,0,Belarus,BY,BLR,9485386,2020-01-21,0,0,0.0,0.0,1,1,2226,23,2
1036,22/01/2020,22,1,2020,0,0,Belarus,BY,BLR,9485386,2020-01-22,0,0,0.0,0.0,1,1,2226,23,2
1035,23/01/2020,23,1,2020,0,0,Belarus,BY,BLR,9485386,2020-01-23,0,0,0.0,0.0,1,1,2226,23,2
1034,24/01/2020,24,1,2020,0,0,Belarus,BY,BLR,9485386,2020-01-24,0,0,0.0,0.0,1,1,2226,23,2
1033,25/01/2020,25,1,2020,0,0,Belarus,BY,BLR,9485386,2020-01-25,0,0,0.0,0.0,1,1,2226,23,2
1032,26/01/2020,26,1,2020,0,0,Belarus,BY,BLR,9485386,2020-01-26,0,0,0.0,0.0,1,1,2226,23,2
1031,27/01/2020,27,1,2020,0,0,Belarus,BY,BLR,9485386,2020-01-27,0,0,0.0,0.0,1,1,2226,23,2
1030,28/01/2020,28,1,2020,0,0,Belarus,BY,BLR,9485386,2020-01-28,0,0,0.0,0.0,1,1,2226,23,2
1029,29/01/2020,29,1,2020,0,0,Belarus,BY,BLR,9485386,2020-01-29,0,0,0.0,0.0,1,1,2226,23,2
1028,30/01/2020,30,1,2020,0,0,Belarus,BY,BLR,9485386,2020-01-30,0,0,0.0,0.0,1,1,2226,23,2
1027,31/01/2020,31,1,2020,0,0,Belarus,BY,BLR,9485386,2020-01-31,0,0,0.0,0.0,1,1,2226,23,2
1026,01/02/2020,1,2,2020,0,0,Belarus,BY,BLR,9485386,2020-02-01,0,0,0.0,0.0,1,1,2226,23,2
1025,02/02/2020,2,2,2020,0,0,Belarus,BY,BLR,9485386,2020-02-02,0,0,0.0,0.0,1,1,2226,23,2
1024,03/02/2020,3,2,2020,0,0,Belarus,BY,BLR,9485386,2020-02-03,0,0,0.0,0.0,1,1,2226,23,2
1023,04/02/2020,4,2,2020,0,0,Belarus,BY,BLR,9485386,2020-02-04,0,0,0.0,0.0,1,1,2226,23,2
1022,05/02/2020,5,2,2020,0,0,Belarus,BY,BLR,9485386,2020-02-05,0,0,0.0,0.0,1,1,2226,23,2
1021,06/02/2020,6,2,2020,0,0,Belarus,BY,BLR,9485386,2020-02-06,0,0,0.0,0.0,1,1,2226,23,2
1020,07/02/2020,7,2,2020,0,0,Belarus,BY,BLR,9485386,2020-02-07,0,0,0.0,0.0,1,1,2226,23,2
1019,08/02/2020,8,2,2020,0,0,Belarus,BY,BLR,9485386,2020-02-08,0,0,0.0,0.0,1,1,2226,23,2
1018,09/02/2020,9,2,2020,0,0,Belarus,BY,BLR,9485386,2020-02-09,0,0,0.0,0.0,1,1,2226,23,2
1017,10/02/2020,10,2,2020,0,0,Belarus,BY,BLR,9485386,2020-02-10,0,0,0.0,0.0,1,1,2226,23,2
1016,11/02/2020,11,2,2020,0,0,Belarus,BY,BLR,9485386,2020-02-11,0,0,0.0,0.0,1,1,2226,23,2
1015,12/02/2020,12,2,2020,0,0,Belarus,BY,BLR,9485386,2020-02-12,0,0,0.0,0.0,1,1,2226,23,2
1014,13/02/2020,13,2,2020,0,0,Belarus,BY,BLR,9485386,2020-02-13,0,0,0.0,0.0,1,1,2226,23,2
1013,14/02/2020,14,2,2020,0,0,Belarus,BY,BLR,9485386,2020-02-14,0,0,0.0,0.0,1,1,2226,23,2
1012,15/02/2020,15,2,2020,0,0,Belarus,BY,BLR,9485386,2020-02-15,0,0,0.0,0.0,1,1,2226,23,2
1011,16/02/2020,16,2,2020,0,0,Belarus,BY,BLR,9485386,2020-02-16,0,0,0.0,0.0,1,1,2226,23,2
1010,17/02/2020,17,2,2020,0,0,Belarus,BY,BLR,9485386,2020-02-17,0,0,0.0,0.0,1,1,2226,23,2
1009,18/02/2020,18,2,2020,0,0,Belarus,BY,BLR,9485386,2020-02-18,0,0,0.0,0.0,1,1,2226,23,2
1008,19/02/2020,19,2,2020,0,0,Belarus,BY,BLR,9485386,2020-02-19,0,0,0.0,0.0,1,1,2226,23,2
1007,20/02/2020,20,2,2020,0,0,Belarus,BY,BLR,9485386,2020-02-20,0,0,0.0,0.0,1,1,2226,23,2
1006,21/02/2020,21,2,2020,0,0,Belarus,BY,BLR,9485386,2020-02-21,0,0,0.0,0.0,1,1,2226,23,2
1005,22/02/2020,22,2,2020,0,0,Belarus,BY,BLR,9485386,2020-02-22,0,0,0.0,0.0,1,1,2226,23,2
1004,23/02/2020,23,2,2020,0,0,Belarus,BY,BLR,9485386,2020-02-23,0,0,0.0,0.0,1,1,2226,23,2
1003,24/02/2020,24,2,2020,0,0,Belarus,BY,BLR,9485386,2020-02-24,0,0,0.0,0.0,1,1,2226,23,2
1002,25/02/2020,25,2,2020,0,0,Belarus,BY,BLR,9485386,2020-02-25,0,0,0.0,0.0,1,1,2226,23,2
1001,26/02/2020,26,2,2020,0,0,Belarus,BY,BLR,9485386,2020-02-26,0,0,0.0,0.0,1,1,2226,23,2
1000,27/02/2020,27,2,2020,0,0,Belarus,BY,BLR,9485386,2020-02-27,0,0,0.0,0.0,1,1,2226,23,2
999,28/02/2020,28,2,2020,1,0,Belarus,BY,BLR,9485386,2020-02-28,1,0,0.0,0.0,0,1,2226,23,2
998,29/02/2020,29,2,2020,0,0,Belarus,BY,BLR,9485386,2020-02-29,1,0,1.0,0.0,1,1,2226,23,2
997,01/03/2020,1,3,2020,0,0,Belarus,BY,BLR,9485386,2020-03-01,1,0,0.0,0.0,1,1,2226,23,2
996,02/03/2020,2,3,2020,0,0,Belarus,BY,BLR,9485386,2020-03-02,1,0,0.0,0.0,1,1,2226,23,2
995,04/03/2020,4,3,2020,3,0,Belarus,BY,BLR,9485386,2020-03-04,4,0,0.0,0.0,0,1,2226,23,2
994,05/03/2020,5,3,2020,2,0,Belarus,BY,BLR,9485386,2020-03-05,6,0,3.0,0.0,1,1,2226,23,2
993,11/03/2020,11,3,2020,3,0,Belarus,BY,BLR,9485386,2020-03-11,9,0,2.0,0.0,0,1,2226,23,2
992,12/03/2020,12,3,2020,3,0,Belarus,BY,BLR,9485386,2020-03-12,12,0,3.0,0.0,1,1,2226,23,2
991,13/03/2020,13,3,2020,9,0,Belarus,BY,BLR,9485386,2020-03-13,21,0,3.0,0.0,0,1,2226,23,2
990,16/03/2020,16,3,2020,6,0,Belarus,BY,BLR,9485386,2020-03-16,27,0,9.0,0.0,1,1,2226,23,2
989,17/03/2020,17,3,2020,9,0,Belarus,BY,BLR,9485386,2020-03-17,36,0,6.0,0.0,0,1,2226,23,2
988,18/03/2020,18,3,2020,0,0,Belarus,BY,BLR,9485386,2020-03-18,36,0,9.0,0.0,1,1,2226,23,2
987,19/03/2020,19,3,2020,10,0,Belarus,BY,BLR,9485386,2020-03-19,46,0,0.0,0.0,0,1,2226,23,2
986,20/03/2020,20,3,2020,11,0,Belarus,BY,BLR,9485386,2020-03-20,57,0,10.0,0.0,0,1,2226,23,2
985,21/03/2020,21,3,2020,0,0,Belarus,BY,BLR,9485386,2020-03-21,57,0,11.0,0.0,1,1,2226,23,2
984,22/03/2020,22,3,2020,19,0,Belarus,BY,BLR,9485386,2020-03-22,76,0,0.0,0.0,0,1,2226,23,2
983,23/03/2020,23,3,2020,0,0,Belarus,BY,BLR,9485386,2020-03-23,76,0,19.0,0.0,1,1,2226,23,2
982,24/03/2020,24,3,2020,5,0,Belarus,BY,BLR,9485386,2020-03-24,81,0,0.0,0.0,0,1,2226,23,2
981,25/03/2020,25,3,2020,0,0,Belarus,BY,BLR,9485386,2020-03-25,81,0,5.0,0.0,1,1,2226,23,2
980,26/03/2020,26,3,2020,5,0,Belarus,BY,BLR,9485386,2020-03-26,86,0,0.0,0.0,0,1,2226,23,2
979,27/03/2020,27,3,2020,0,0,Belarus,BY,BLR,9485386,2020-03-27,86,0,5.0,0.0,1,1,2226,23,2
978,28/03/2020,28,3,2020,8,0,Belarus,BY,BLR,9485386,2020-03-28,94,0,0.0,0.0,0,1,2226,23,2
977,29/03/2020,29,3,2020,0,0,Belarus,BY,BLR,9485386,2020-03-29,94,0,8.0,0.0,1,1,2226,23,2
976,30/03/2020,30,3,2020,0,0,Belarus,BY,BLR,9485386,2020-03-30,94,0,0.0,0.0,1,1,2226,23,2
975,31/03/2020,31,3,2020,11,0,Belarus,BY,BLR,9485386,2020-03-31,105,0,0.0,0.0,0,1,2226,23,2
974,01/04/2020,1,4,2020,47,0,Belarus,BY,BLR,9485386,2020-04-01,152,0,11.0,0.0,0,1,2226,23,2
973,02/04/2020,2,4,2020,0,0,Belarus,BY,BLR,9485386,2020-04-02,152,0,47.0,0.0,1,1,2226,23,2
972,03/04/2020,3,4,2020,102,4,Belarus,BY,BLR,9485386,2020-04-03,254,4,0.0,0.0,0,0,2226,23,2
971,04/04/2020,4,4,2020,97,0,Belarus,BY,BLR,9485386,2020-04-04,351,4,102.0,4.0,1,1,2226,23,2
970,05/04/2020,5,4,2020,43,1,Belarus,BY,BLR,9485386,2020-04-05,394,5,97.0,0.0,1,0,2226,23,2
969,06/04/2020,6,4,2020,170,3,Belarus,BY,BLR,9485386,2020-04-06,564,8,43.0,1.0,0,0,2226,23,2
968,07/04/2020,7,4,2020,136,5,Belarus,BY,BLR,9485386,2020-04-07,700,13,170.0,3.0,1,0,2226,23,2
967,08/04/2020,8,4,2020,161,0,Belarus,BY,BLR,9485386,2020-04-08,861,13,136.0,5.0,0,1,2226,23,2
966,09/04/2020,9,4,2020,205,0,Belarus,BY,BLR,9485386,2020-04-09,1066,13,161.0,0.0,0,1,2226,23,2
965,10/04/2020,10,4,2020,420,3,Belarus,BY,BLR,9485386,2020-04-10,1486,16,205.0,0.0,0,0,2226,23,2
964,11/04/2020,11,4,2020,495,3,Belarus,BY,BLR,9485386,2020-04-11,1981,19,420.0,3.0,0,1,2226,23,2
963,12/04/2020,12,4,2020,245,4,Belarus,BY,BLR,9485386,2020-04-12,2226,23,495.0,3.0,1,0,2226,23,2
1162,31/12/2019,31,12,2019,0,0,Belgium,BE,BEL,11422068,2019-12-31,0,0,0.0,0.0,1,1,28018,3346,4
1161,01/01/2020,1,1,2020,0,0,Belgium,BE,BEL,11422068,2020-01-01,0,0,0.0,0.0,1,1,28018,3346,4
1160,02/01/2020,2,1,2020,0,0,Belgium,BE,BEL,11422068,2020-01-02,0,0,0.0,0.0,1,1,28018,3346,4
1159,03/01/2020,3,1,2020,0,0,Belgium,BE,BEL,11422068,2020-01-03,0,0,0.0,0.0,1,1,28018,3346,4
1158,04/01/2020,4,1,2020,0,0,Belgium,BE,BEL,11422068,2020-01-04,0,0,0.0,0.0,1,1,28018,3346,4
1157,05/01/2020,5,1,2020,0,0,Belgium,BE,BEL,11422068,2020-01-05,0,0,0.0,0.0,1,1,28018,3346,4
1156,06/01/2020,6,1,2020,0,0,Belgium,BE,BEL,11422068,2020-01-06,0,0,0.0,0.0,1,1,28018,3346,4
1155,07/01/2020,7,1,2020,0,0,Belgium,BE,BEL,11422068,2020-01-07,0,0,0.0,0.0,1,1,28018,3346,4
1154,08/01/2020,8,1,2020,0,0,Belgium,BE,BEL,11422068,2020-01-08,0,0,0.0,0.0,1,1,28018,3346,4
1153,09/01/2020,9,1,2020,0,0,Belgium,BE,BEL,11422068,2020-01-09,0,0,0.0,0.0,1,1,28018,3346,4
1152,10/01/2020,10,1,2020,0,0,Belgium,BE,BEL,11422068,2020-01-10,0,0,0.0,0.0,1,1,28018,3346,4
1151,11/01/2020,11,1,2020,0,0,Belgium,BE,BEL,11422068,2020-01-11,0,0,0.0,0.0,1,1,28018,3346,4
1150,12/01/2020,12,1,2020,0,0,Belgium,BE,BEL,11422068,2020-01-12,0,0,0.0,0.0,1,1,28018,3346,4
1149,13/01/2020,13,1,2020,0,0,Belgium,BE,BEL,11422068,2020-01-13,0,0,0.0,0.0,1,1,28018,3346,4
1148,14/01/2020,14,1,2020,0,0,Belgium,BE,BEL,11422068,2020-01-14,0,0,0.0,0.0,1,1,28018,3346,4
1147,15/01/2020,15,1,2020,0,0,Belgium,BE,BEL,11422068,2020-01-15,0,0,0.0,0.0,1,1,28018,3346,4
1146,16/01/2020,16,1,2020,0,0,Belgium,BE,BEL,11422068,2020-01-16,0,0,0.0,0.0,1,1,28018,3346,4
1145,17/01/2020,17,1,2020,0,0,Belgium,BE,BEL,11422068,2020-01-17,0,0,0.0,0.0,1,1,28018,3346,4
1144,18/01/2020,18,1,2020,0,0,Belgium,BE,BEL,11422068,2020-01-18,0,0,0.0,0.0,1,1,28018,3346,4
1143,19/01/2020,19,1,2020,0,0,Belgium,BE,BEL,11422068,2020-01-19,0,0,0.0,0.0,1,1,28018,3346,4
1142,20/01/2020,20,1,2020,0,0,Belgium,BE,BEL,11422068,2020-01-20,0,0,0.0,0.0,1,1,28018,3346,4
1141,21/01/2020,21,1,2020,0,0,Belgium,BE,BEL,11422068,2020-01-21,0,0,0.0,0.0,1,1,28018,3346,4
1140,22/01/2020,22,1,2020,0,0,Belgium,BE,BEL,11422068,2020-01-22,0,0,0.0,0.0,1,1,28018,3346,4
1139,23/01/2020,23,1,2020,0,0,Belgium,BE,BEL,11422068,2020-01-23,0,0,0.0,0.0,1,1,28018,3346,4
1138,24/01/2020,24,1,2020,0,0,Belgium,BE,BEL,11422068,2020-01-24,0,0,0.0,0.0,1,1,28018,3346,4
1137,25/01/2020,25,1,2020,0,0,Belgium,BE,BEL,11422068,2020-01-25,0,0,0.0,0.0,1,1,28018,3346,4
1136,26/01/2020,26,1,2020,0,0,Belgium,BE,BEL,11422068,2020-01-26,0,0,0.0,0.0,1,1,28018,3346,4
1135,27/01/2020,27,1,2020,0,0,Belgium,BE,BEL,11422068,2020-01-27,0,0,0.0,0.0,1,1,28018,3346,4
1134,28/01/2020,28,1,2020,0,0,Belgium,BE,BEL,11422068,2020-01-28,0,0,0.0,0.0,1,1,28018,3346,4
1133,29/01/2020,29,1,2020,0,0,Belgium,BE,BEL,11422068,2020-01-29,0,0,0.0,0.0,1,1,28018,3346,4
1132,30/01/2020,30,1,2020,0,0,Belgium,BE,BEL,11422068,2020-01-30,0,0,0.0,0.0,1,1,28018,3346,4
1131,31/01/2020,31,1,2020,0,0,Belgium,BE,BEL,11422068,2020-01-31,0,0,0.0,0.0,1,1,28018,3346,4
1130,01/02/2020,1,2,2020,0,0,Belgium,BE,BEL,11422068,2020-02-01,0,0,0.0,0.0,1,1,28018,3346,4
1129,02/02/2020,2,2,2020,0,0,Belgium,BE,BEL,11422068,2020-02-02,0,0,0.0,0.0,1,1,28018,3346,4
